id,recipeName,rating,totalTimeInSeconds,course,cuisine,ingredients,dish
Guac-and-Black-Bean-Burritos-1262923,Guac and Black Bean Burritos,4,1500.0,[Main Dishes],[Mexican],"[guacamole, avocado, garlic, purple onion, serrano chile, lime, salt, cilantro, small tomatoes, large flour tortillas, brown rice, black beans, tomatoes, onions, lettuce, jack cheese]",burrito
Beef-and-Bean-Burritos-1349463,Beef and Bean Burritos,4,2400.0,[Main Dishes],,"[oil, onions, garlic cloves, ground beef, brown rice, chili powder, cumin, salt, pepper, tomato sauce, refried beans, shredded cheddar cheese, large flour tortillas]",burrito
Black-Bean-and-Guac-Burritos-Naturally-Ella-46521,Black Bean and Guac Burritos,5,1500.0,[Main Dishes],[Mexican],"[avocado, garlic, purple onion, serrano chile, lime, salt, cilantro, tomatoes, flour tortillas, brown rice, black beans, lettuce, jack cheese]",burrito
Chile-Colorado-Burritos-608961,Chile Colorado Burritos,3,3900.0,[Main Dishes],[Kid-Friendly],"[stew meat, red enchilada sauce, beef stock cubes, refried beans, large flour tortillas, shredded cheddar cheese]",burrito
Chorizo-Breakfast-Burritos-1280233,Chorizo Breakfast Burritos,4,2700.0,[Breakfast and Brunch],,"[eggs, salt, black pepper, mexican chorizo, butter, russet potatoes, shredded cheddar cheese, jack cheese, large flour tortillas]",burrito
Easy-Veggie-Breakfast-Burritos-1365839,Easy Veggie Breakfast Burritos,4,900.0,[Breakfast and Brunch],,"[butter, flour tortillas, cheddar cheese, veggies]",burrito
Breakfast-Burrito-1215305,Breakfast Burrito,4,2100.0,[Breakfast and Brunch],,"[eggs, milk, green bell pepper, red bell pepper, yellow onion, large flour tortillas, shredded pepper jack cheese, colby cheese, bacon, salt, pepper]",burrito
Ham_-Egg_-and-Avocado-Breakfast-Burrito-1366439,"Ham, Egg, and Avocado Breakfast Burrito",4,1200.0,[Breakfast and Brunch],,"[eggs, milk, cooked ham, avocado, cheese, whole wheat tortillas]",burrito
Breakfast-Burritos-MyRecipes-237423,Breakfast Burritos,3,,"[Lunch and Snacks, Breakfast and Brunch]","[Southwestern, American, Mexican]","[bacon, eggs, salt, pepper, flour tortillas, shredded cheddar cheese, sliced green onions]",burrito
Veggie-Quinoa-Burritos-1379609,Veggie Quinoa Burritos,4,3900.0,[Main Dishes],[Mexican],"[onions, jalapeno chilies, quinoa, garlic, vegetable broth, low-fat sour cream, chopped cilantro fresh, lime juice, chili pepper, frozen corn, shredded zucchini, chopped tomatoes, whole wheat tortillas, pepper jack, salsa, guacamole]",burrito
20-Minute-Healthy-Chicken-Burrito-1275179,20 Minute Healthy Chicken Burrito,4,,,,"[large flour tortillas, boneless skinless chicken breasts, black beans, yellow onion, chili powder, cumin, cooking spray, Mexican cheese blend, salsa, sour cream]",burrito
Southwest-Beef-and-Bean-Burritos-1363401,Southwest Beef and Bean Burritos,3,33600.0,[Main Dishes],,"[cooking spray, boneless beef chuck roast, taco seasoning mix, tomato sauce, black beans, flour tortillas, Mexican cheese blend, green leaf lettuce]",burrito
Burrito-1371972,Burrito,4,3900.0,[Main Dishes],,"[cake, sunflower oil, beans, salad, tomatoes, green onions, cheddar cheese, onions, chili powder, cumin, salt, pepper, pineapple, chicken, sausages, blue cheese, pears, cheese]",burrito
Freezer-Black-Bean-Fajita-Burritos-1363211,Freezer Black Bean Fajita Burritos,4,1920.0,"[Lunch and Snacks, Main Dishes]",[Mexican],"[bell pepper, purple onion, chili powder, fajita seasoning mix, cooked brown rice, salt, black beans, lime, shredded cheddar cheese, tortilla shells]",burrito
Fruit-burritos-296466,Fruit Burritos,4,600.0,"[Breakfast and Brunch, Lunch and Snacks]",,"[nonfat vanilla yogurt, Skippy Creamy Peanut Butter, strawberries, fresh blueberries, whole wheat tortillas, ground cinnamon]",burrito
Breakfast-Burritos-1304287,Breakfast Burritos,4,2100.0,[Breakfast and Brunch],,"[potatoes, breakfast sausages, eggs, chives, seasoning salt, pepper, monterey jack, flour tortillas]",burrito
Freezer-Breakfast-Burritos-1348103,Freezer Breakfast Burritos,4,2700.0,[Breakfast and Brunch],,"[large eggs, milk, salt, pepper, olive oil, white onion, yukon gold potatoes, red bell pepper, Old El Paso™ chopped green chiles, ground cumin, flour tortillas, shredded pepper jack cheese, salsa]",burrito
Crockpot-Jalapeno-Beef-Burritos-1262782,Crockpot Jalapeno Beef Burritos,4,4200.0,[Main Dishes],,"[chuck roast, roma tomatoes, green pepper, onions, garlic cloves, olive oil, ketchup, jalapeno chilies, juice, apple cider vinegar, garlic salt, large flour tortillas, shredded cheddar cheese, green onions, sour cream]",burrito
Breakfast-Burrito-1369545,Breakfast Burrito,3,600.0,[Breakfast and Brunch],,"[whole wheat tortillas, eggs, egg whites, lettuce, fat-free refried beans, reduced fat cheddar cheese, salsa]",burrito
Campfire-Breakfast-Burritos-1346946,Campfire Breakfast Burritos,4,1800.0,[Breakfast and Brunch],,"[large flour tortillas, potatoes, seasoning salt, pepper, green onions, breakfast sausages, eggs, refried beans, cheddar cheese, salsa]",burrito
Vegetarian-Slow-Cooker-Burritos-1363208,Vegetarian Slow Cooker Burritos,4,900.0,[Main Dishes],[Southwestern],"[black beans, rotelle, pearl barley, broth, frozen whole kernel corn, red bell pepper, green onions, lime juice, ground cumin, chili powder, garlic cloves, chopped cilantro fresh, flour tortillas, shredded cheese, baby spinach, mixed greens, salsa, sour cream]",burrito
Simple-smothered-beef-burritos-351000,Simple Smothered Beef Burritos,4,2400.0,[Main Dishes],,"[ground beef, green enchilada sauce, salsa verde, flour tortillas, shredded cheddar cheese]",burrito
Turkey-burritos-298048,Turkey Burritos,4,1200.0,"[Lunch and Snacks, Main Dishes]","[Mexican, Southwestern]","[vegetable oil, red bell pepper, sliced, onions, turkey, hellmann' or best food real mayonnais, prepar salsa, flour tortillas, shredded cheddar cheese]",burrito
Vegan-Breakfast-Burritos-1371562,Vegan Breakfast Burritos,4,1200.0,[Breakfast and Brunch],,"[tofu, nutritional yeast, garlic, tumeric, salt, pepper, frozen hash browns, veggies, salsa, hot sauce, tortillas]",burrito
SPINACH-BURRITOS-How-to-make-a-burrito-1167358,SPINACH BURRITOS-How to make a burrito,4,1200.0,,,"[eggs, baby spinach, burrito size whole wheat tortillas, cheese, olive oil, salt, pepper]",burrito
Greek-Style-Burritos-1377505,Greek-Style Burritos,3,2880.0,[Main Dishes],,"[greek-style vinaigrette, boneless skinless chicken breasts, long grain white rice, lemon zest, flour tortillas, hummus, Athenos Traditional Crumbled Feta Cheese, fresh spinach, nonfat greek yogurt, tomatoes]",burrito
Vegetarian-Burrito-1340164,Vegetarian Burrito,4,2100.0,[Main Dishes],"[Southwestern, Mexican]","[beans, garlic paste, salsa, salt, black pepper, ground cumin, oil, red chili powder, tortillas, guacamole, sour cream, cooked rice, sweet corn, chopped onion, capsicum, tomatoes, lettuce, grating cheese]",burrito
Chicken-burritos-365363,Chicken Burritos,5,1800.0,[Main Dishes],"[Southwestern, Mexican]","[boneless skinless chicken breasts, beans, onions, garlic, tomatoes, olive oil, salt, pepper, chili powder, cumin, jalapeno chilies, cheddar cheese, tortillas, sour cream, salsa]",burrito
Chipotle_s-Chicken-Burrito-1316321,Chipotle's Chicken Burrito,3,1500.0,[Main Dishes],"[Southwestern, Mexican]","[vegetable oil, salsa, chipotle chile, pinto beans, water, rotisserie chicken, cilantro, salt, pepper, tortillas, white rice, monterey jack, romaine lettuce, avocado, roma tomatoes]",burrito
Beef-_-Bean-Chilli-Burritos-1354461,Beef & Bean Chilli Burritos,4,3000.0,[Main Dishes],,"[purple onion, garlic, minced beef, tomatoes, red pepper, smoked paprika, pepper, salt, olive oil, flour tortillas, cheddar cheese]",burrito
Breakfast-Burrito-512247,Breakfast Burrito,5,1500.0,[Breakfast and Brunch],[Mexican],"[olive oil, potatoes, pepper, onions, hot Italian sausages, eggs, milk, flour tortillas, cheddar cheese, salsa]",burrito
Black-Bean-Burger-Breakfast-Burritos-1371004,Black Bean Burger Breakfast Burritos,4,1200.0,[Breakfast and Brunch],,"[veggie burgers, flour tortillas, eggs, colby jack cheese, avocado, salsa, sour cream]",burrito
Make-Ahead-Breakfast-Burritos-471469,Make Ahead Breakfast Burritos,5,2100.0,[Breakfast and Brunch],,"[large eggs, cheese, breakfast sausages, flour tortillas]",burrito
Kid-Approved-Breakfast-Burritos-1036935,Kid Approved Breakfast Burritos,4,1800.0,[Breakfast and Brunch],,"[eggs, water, cheddar cheese, salt, black pepper, flour tortillas]",burrito
Chipotle-Chicken-Burrito-1025990,Chipotle Chicken Burrito,4,2400.0,[Lunch and Snacks],,"[chipotle, rice, canned black beans, cilantro leaves, flour tortillas, cooking oil, colby jack cheese, romaine lettuce leaves, roma tomatoes]",burrito
Chicken-Burritos-My-Recipes,Chicken Burritos,4,,"[Lunch and Snacks, Main Dishes]","[Southwestern, American, Mexican]","[vegetable oil, onions, clove garlic, fine chop, cooked chicken, salt, flour tortillas, iceberg lettuce, tomato salsa, shredded cheddar cheese]",burrito
Crispy-Fiesta-Chicken-Burrito-Wraps-1353927,Crispy Fiesta Chicken Burrito Wraps,4,1200.0,,,"[large flour tortillas, sour cream, oil, sauce, chicken]",burrito
Vegetarian-Black-Bean-Burritos-1033884,Vegetarian Black Bean Burritos,5,1500.0,[Main Dishes],"[Southwestern, Mexican]","[water, fresh lime juice, chili powder, cumin, black pepper, cayenne pepper, canned black beans, green onions, salsa, red bell pepper, zucchini, corn, chopped cilantro, salt, pepper, flour tortillas, monterey jack, olive oil]",burrito
Italian-beef-burritos-298791,Italian Beef Burritos,4,1200.0,"[Lunch and Snacks, Main Dishes]",[Mexican],"[ground beef, chili powder, chunky pasta sauce, regular or convert rice, flour tortillas, shredded mozzarella cheese]",burrito
Easy-Breakfast-Burritos-1290893,Easy Breakfast Burritos,3,2100.0,[Breakfast and Brunch],,"[eggs, Old El Paso™ chopped green chiles, milk, breakfast sausage links, brown hash potato, Old El Paso Flour Tortillas, Mexican cheese blend]",burrito
Super-Simple-Burritos-1371524,Super Simple Burritos,4,1800.0,[Main Dishes],[Mexican],"[ground beef, sea salt, shredded cheese, salsa, whole wheat tortillas, pinto beans, chopped onion, chili powder, olives, sweet corn]",burrito
Breakfast-Burrito-Martha-Stewart-195693,Breakfast Burrito,4,900.0,[Breakfast and Brunch],"[American, Mexican]","[flour tortillas, large eggs, large egg whites, coarse salt, olive oil, pepper jack, pepper sauce]",burrito
Chipotle-Bean-Burritos-MyRecipes-247047,Chipotle Bean Burritos,5,1800.0,[Main Dishes],"[Southwestern, American]","[canola oil, garlic cloves, chipotle chile powder, salt, water, black beans, kidney beans, salsa, flour tortillas, Mexican cheese blend, plum tomatoes, romaine lettuce, sliced green onions, light sour cream]",burrito
How-to-Make-Taco-Bell_s-Burrito-Supreme-1370554,How to Make Taco Bell's Burrito Supreme,3,2100.0,[Main Dishes],[Mexican],"[lean ground beef, chili powder, ground cumin, salt, freshly ground pepper, minced onion, paprika, garlic powder, onion powder, flour, water, large flour tortillas, refried beans, mild salsa, sour cream, shredded cheddar cheese, shredded lettuce, medium tomatoes, white onion]",burrito
Chicken_-Bean_-and-Cheese-Burritos-634139,"Chicken, Bean, and Cheese Burritos",3,1500.0,[Main Dishes],[Kid-Friendly],"[pinto beans, chicken, shredded cheese, salsa verde, tortillas]",burrito
Easy-Chicken-Burritos-_Perfect-for-the-Freezer__-1371422,Easy Chicken Burritos (Perfect for the Freezer!),4,2100.0,[Main Dishes],,"[whole wheat tortillas, cooked chicken, shredded cheese, salsa, sea salt, chili powder]",burrito
Bean-Burritos-Martha-Stewart,Bean Burritos,4,3600.0,[Main Dishes],"[American, Mexican]","[rice, olive oil, onions, garlic cloves, jalapeno chilies, ground cumin, coarse salt, ground pepper, tomato paste, pinto beans, corn kernels, scallions, large flour tortillas, shredded Monterey Jack cheese, salsa, sour cream]",burrito
Baked-Black-Bean-and-Avocado-Burritos-1078083,Baked Black Bean and Avocado Burritos,4,2100.0,[Main Dishes],[Mexican],"[chipotles in adobo, regular sour cream, low sodium black beans, corn kernels, avocado, flour tortillas, salsa, cheddar cheese]",burrito
Campfire-Breakfast-Burritos-1234639,Campfire Breakfast Burritos,3,2100.0,[Breakfast and Brunch],,"[flour tortillas, eggs, hash brown, pepper jack, sausages]",burrito
Easy-Breakfast-Burrito-982363,Easy Breakfast Burrito,4,900.0,[Breakfast and Brunch],,"[whole wheat tortillas, eggs, pico de gallo, sour cream, shredded cheddar cheese, guacamole, salsa]",burrito
Dan_s-chipotle-rice-burritos-299234,Dan's Chipotle Rice Burritos,4,1200.0,"[Lunch and Snacks, Main Dishes]",[Mexican],"[Knorr® Fiesta Sides Spanish Rice, water, I Can't Believe It's Not Butter!® Spread, red kidney beans, shredded Monterey Jack cheese, flour tortillas, chopped cilantro fresh, chipotles in adobo]",burrito
Burrito-Pie-1284319,Burrito Pie,4,3300.0,[Main Dishes],,"[ground beef, onions, taco seasoning, large flour tortillas, refried beans, cream of mushroom soup, sour cream, shredded cheddar cheese, green onions]",burrito
Taco-Bell-Chicken-Burrito-1302786,Taco Bell Chicken Burrito,4,3900.0,[Main Dishes],[Mexican],"[boneless skinless chicken breasts, olive oil, tomato sauce, white vinegar, garlic cloves, chili powder, ground cumin, oregano, sugar, salt, pepper, butter, long grain white rice, chicken broth, ground black pepper, lime, chopped cilantro, cumin, ranch dressing, buttermilk, avocado, sour cream, shredded cheddar cheese, flour tortillas]",burrito
Breakfast-Burritos-Allrecipes_1,Breakfast Burritos,5,1200.0,"[Breakfast and Brunch, Lunch and Snacks]","[American, Mexican, Southwestern]","[bacon, eggs, salt, pepper, flour tortillas, shredded cheddar cheese, green onions]",burrito
Cheesy-Chicken-and-Black-Bean-Burritos-498013,Cheesy Chicken and Black Bean Burritos,4,1200.0,[Main Dishes],"[American, Mexican, Southwestern]","[canola oil, chopped onion, rotisserie chicken, ground cumin, garlic, salt, black beans, flour tortillas, pepper jack, cooking spray, salsa, pico de gallo, cream]",burrito
Wet-Burritos-1101259,Wet Burritos,4,2400.0,[Main Dishes],[Mexican],"[ground beef, onions, garlic cloves, cumin, salt, chili powder, oregano, pepper, bell pepper, green chilies, refried beans, chili, condensed tomato soup, enchilada sauce, flour tortillas, sharp cheddar cheese, shredded lettuce, tomatoes]",burrito
Sweet-Potato-Bean-Burritos-1248930,Sweet Potato Bean Burritos,4,5400.0,[Main Dishes],[Southwestern],"[sweet potatoes, vegetable oil, onions, garlic, kidney beans, black beans, water, chili powder, soy sauce, prepared mustard, ground cumin, cayenne pepper, large flour tortillas, shredded cheddar cheese, jack cheese, sour cream, salsa, guacamole, cilantro, green onions]",burrito
Recipe-For-Chipotle-Burritos-_Copycat_-1235049,Recipe For Chipotle Burritos (Copycat),3,1500.0,[Main Dishes],"[Southwestern, Mexican]","[chicken, cumin, garlic, sweet onion, salt, pepper, diced tomatoes, diced red onions, jalapeno chilies, cooked rice, lemon juice, lime juice, cilantro, black beans, sour cream, guacamole, flour tortillas]",burrito
Butternut-Squash_-Kale_-and-Gouda-Breakfast-Burritos-1378325,"Butternut Squash, Kale, and Gouda Breakfast Burritos",4,2700.0,[Breakfast and Brunch],,"[butter oil, yellow onion, garlic, butternut squash, crimini mushrooms, kale, large eggs, milk, butter, shredded gouda cheese, whole wheat tortillas]",burrito
California-Burritos-1321353,California Burritos,4,2700.0,[Main Dishes],,"[sirloin steak, olive oil, lime, white vinegar, garlic cloves, jalapeno chilies, cilantro leaves, salt, black pepper, chopped tomatoes, purple onion, cilantro, pepper, flour tortillas, shredded sharp cheddar cheese, french fries, shredded lettuce, sour cream]",burrito
Frozen-Healthy-Breakfast-Burritos-625907,Frozen Healthy Breakfast Burritos,3,2400.0,[Breakfast and Brunch],,"[eggs, skim milk, red pepper, green pepper, onions, turkey sausage, reduced fat cheddar cheese, whole wheat tortillas]",burrito
Breakfast-Burrito-1018914,Breakfast Burrito,4,2100.0,[Breakfast and Brunch],"[Southwestern, Mexican]","[flour tortillas, eggs, bacon, pepper jack, green onions, onions, mushrooms, jack cheese, guacamole, salsa, sour cream, olive oil, pepper, salt, cayenne pepper, chili powder, ground cumin, cilantro, diced tomatoes]",burrito
Make-Ahead-Freezable-Breakfast-Burritos-1330151,Make-Ahead Freezable Breakfast Burritos,4,2400.0,[Breakfast and Brunch],,"[olive oil, turkey breakfast sausage, red bell pepper, sweet onion, large tomato, eggs, pepper, low-fat shredded cheddar cheese, whole wheat tortillas]",burrito
Copycat-Steak-Burritos-1304965,Copycat Steak Burritos,4,2700.0,[Main Dishes],"[Barbecue, Mexican]","[dried oregano, ground cumin, garlic powder, onion powder, ancho powder, cayenne pepper, ground black pepper, kosher salt, skirt steak, vegetable oil, roma tomatoes, diced red onions, jalapeno chilies, chopped cilantro fresh, cooked brown rice, fresh lime juice, flour tortillas, low sodium black beans, sour cream]",burrito
Pan-Roasted-Homemade-Breakfast-Burritos-1327410,Pan Roasted Homemade Breakfast Burritos,4,2400.0,[Breakfast and Brunch],,"[large flour tortillas, eggs, breakfast sausages, yukon gold potatoes, sweet onion, Mexican cheese, lacinato kale, cream of mushroom soup, extra-virgin olive oil, sea salt, black peppercorns, sour cream, Sriracha, Anaheim chile]",burrito
Seven-Layer-Burritos-1332966,Seven Layer Burritos,4,1200.0,[Main Dishes],,"[flour tortillas, refried beans, uncle bens, shredded cheddar cheese, shredded lettuce, diced tomatoes, sour cream, guacamole]",burrito
Addicting-Sweet-Potato-and-Black-Bean-Freezer-Burritos-1323947,Addicting Sweet Potato and Black Bean Freezer Burritos,4,2400.0,,,"[sweet potatoes, black beans, onions, pepper, garlic salt, cumin, spices, jack cheese, green onions, sour cream, flour tortillas]",burrito
Mexican-Breakfast-Burritos-684311,Mexican Breakfast Burritos,4,1500.0,[Breakfast and Brunch],"[Southwestern, Mexican]","[eggs, salsa, black beans, corn, diced tomatoes, chopped cilantro fresh, cumin, salt, lime, cheddar cheese, flour tortillas]",burrito
Microwave-Egg-_-Cheese-Breakfast-Burrito-496686,Microwave Egg & Cheese Breakfast Burrito,4,180.0,[Breakfast and Brunch],,"[flour tortillas, eggs, Mexican cheese blend, salsa]",burrito
Southwest-Breakfast-Burritos-1042724,Southwest Breakfast Burritos,4,2100.0,[Breakfast and Brunch],,"[tortillas, eggs, grating cheese, bacon, sausage links, potatoes]",burrito
Bacon-Chili-Dog-Burrito-1059222,Bacon Chili Dog Burrito,4,900.0,[Main Dishes],,"[hot dogs, bacon, jack cheese, chili, flour tortillas, butter]",burrito
Breakfast-Burritos-1068051,Breakfast Burritos,4,1500.0,[Breakfast and Brunch],,"[flour tortillas, eggs, chorizo sausage, cheddar cheese]",burrito
Black-bean-and-rice-freezer-burritos-365074,Black Bean and Rice Freezer Burritos,5,1800.0,[Main Dishes],[Mexican],"[rice, black beans, taco seasoning, pepper jack, monterey jack, tortillas]",burrito
Breakfast-Burrito-Bites-1317059,Breakfast Burrito Bites,4,1200.0,[Breakfast and Brunch],,"[chopped bell pepper, olive oil, eggs, water, whole wheat tortillas]",burrito
Veggie-Fajita-Burritos-1097941,Veggie Fajita Burritos,4,2400.0,[Main Dishes],"[Southwestern, Mexican]","[jasmine, chopped cilantro, lime, red bell pepper, green bell pepper, white onion, salt, black beans, green chile, cumin, garlic powder, shredded cheddar cheese, sour cream, guacamole, salsa, flour tortillas, lime wedges]",burrito
Chicken-Burritos-MyRecipes-232755,Chicken Burritos,4,3000.0,"[Lunch and Snacks, Main Dishes]",,"[boneless skinless chicken breasts, salsa, sour cream, flour tortillas, cream of chicken soup, Mexican cheese blend, chopped tomatoes, sliced green onions]",burrito
Breakfast-Burrito-1267938,Breakfast Burrito,4,780.0,[Breakfast and Brunch],,"[Flatout® Flatbreads, egg whites, baby spinach leaves, canned black beans, fat free feta cheese, sun-dried tomatoes, salt, pepper]",burrito
Skinny-Burrito-Bowls-1367312,Skinny Burrito Bowls,4,1500.0,[Main Dishes],,"[diced onions, lean ground turkey, brown rice, low sodium chicken broth, salsa, taco seasoning, black beans, corn kernels, diced tomatoes, sea salt, ground pepper, cheddar cheese, fresh chives]",burrito
Breakfast-Burrito-1360838,Breakfast Burrito,4,2700.0,[Breakfast and Brunch],,"[chorizo sausage, eggs, potatoes, white onion, cheese, parsley, butter, tortillas, salsa, salt, pepper]",burrito
Grilled-Burritos-1064168,Grilled Burritos,4,1500.0,[Main Dishes],,"[ground beef, taco seasoning, tortillas, refried beans, tomatoes, shredded lettuce, sour cream, colby jack cheese, guacamole]",burrito
Easy-Meal-Burritos-995586,Easy Meal Burritos,3,1800.0,[Main Dishes],,"[yellow rice, black beans, flour tortillas, salsa, Sargento® Traditional Cut Shredded 4 Cheese Mexican]",burrito
Easy-Pressure-Cooker-Chile-Colorado-Smothered-Burritos-1163446,Easy Pressure Cooker Chile Colorado Smothered Burritos,4,3000.0,[Main Dishes],,"[rump roast, enchilada sauce, beef stock cubes, water, large flour tortillas, shredded cheese]",burrito
Tasty-burritos-370122,Tasty Burritos,4,1200.0,[Main Dishes],,"[ground beef, taco seasoning, refried beans, flour tortillas, shredded colby, canola oil, sour cream]",burrito
The-Thanksgiving-Burrito-1355607,The Thanksgiving Burrito,4,2100.0,[Main Dishes],,"[cranberries, apples, garlic, lime, honey, purple onion, salt, stuffing, pinto beans, squash, pepper, onions, turkey, corn salsa, cheese, sour cream]",burrito
Heart-Healthy-Burrito-Allrecipes,Heart Healthy Burrito,4,780.0,,,"[flour tortillas, grilled chicken strips, brown rice, broccoli, cheddar cheese]",burrito
Sweet-Potato-and-Black-Bean-Burritos-1155390,Sweet Potato and Black Bean Burritos,3,1800.0,[Main Dishes],,"[olive oil, sweet potatoes, purple onion, kosher salt, pepper, black beans, chipotle peppers, spinach, monterey jack, large flour tortillas, low-fat sour cream, fresh lime juice, romaine lettuce]",burrito
Copycat-Chipotle-Chicken-Burrito-974469,Copycat Chipotle Chicken Burrito,4,3900.0,[Main Dishes],[Mexican],"[flour tortillas, boneless skinless chicken breasts, tenderloin, chili beans, black beans, sour cream, roma tomatoes, romaine lettuce, lime, cilantro, salt, black pepper, cumin, chili powder, garlic, oregano, onions, oil, butter, jalapeno chilies, guacamole, hot sauce, salsa]",burrito
Chile-Colorado-Burritos-1372189,Chile Colorado Burritos,3,23700.0,[Main Dishes],,"[boneless beef chuck roast, enchilada sauce, beef bouillon granules, refried beans, flour tortillas, monterey jack, green onions]",burrito
Crispy-Chipotle-Tofu-and-Black-Bean-Burritos-1322110,Crispy Chipotle Tofu and Black Bean Burritos,4,1500.0,[Main Dishes],[Southwestern],"[olive oil, small yellow onion, red bell pepper, garlic, chipotle, reduced sodium black beans, chili powder, cumin, cilantro, black pepper, kosher salt, low sodium vegetable broth, whole wheat tortillas, cooked quinoa, Haas avocados, reduced fat Mexican cheese, salsa, greek yogurt]",burrito
Bean-Burritos-1077793,Bean Burritos,4,2700.0,,"[Southwestern, Mexican]","[cooked brown rice, canola oil, onions, garlic cloves, jalapeno chilies, chili powder, ground cumin, tomato paste, low sodium black beans, low sodium pinto beans, water, frozen sweet corn, chopped cilantro fresh, flour tortillas, shredded reduced fat cheddar cheese]",burrito
Crunchy-Taco-Burritos-1290912,Crunchy Taco Burritos,3,2400.0,[Main Dishes],,"[ground beef, water, milk, Hamburger Helper, Old El Paso Flour Tortillas, sliced green onions, large tomato]",burrito
Breakfast-Burrito-Martha-Stewart-197395,Breakfast Burrito,4,2100.0,[Breakfast and Brunch],[Mexican],"[flour tortillas, chorizo sausage, large eggs, monterey jack, prepar salsa, hot sauce]",burrito
Black-bean-and-avocado-burritos-with-jicama-cucumber-slaw-348339,Black Bean and Avocado Burritos with Jicama-Cucumber Slaw,4,1500.0,,,"[extra-virgin olive oil, black beans, garlic, salt, pepper, large flour tortillas, avocado, shredded Monterey Jack cheese, fresh lemon juice, english cucumber, jicama]",burrito
Best-Burritos-Allrecipes,Best Burritos,4,1200.0,,"[Mexican, Kid-Friendly]","[flour tortillas, vegetarian refried beans, American cheese, ground black pepper, low-fat sour cream, hot pepper sauce]",burrito
Everyones-Favorite-Taco-Bell-Burritos-1280018,Everyone’s Favorite Taco Bell Burritos,3,3000.0,[Main Dishes],[Mexican],"[steak, taco seasoning, salsa, refried beans, flour tortillas, enchilada sauce, sour cream, shredded lettuce, shredded mild cheddar cheese, tomatoes, yellow onion]",burrito
Brown-Rice-and-Black-Bean-Burrito-750761,Brown Rice and Black Bean Burrito,3,1800.0,[Main Dishes],[Southwestern],"[brown rice, vegetable oil, onions, garlic cloves, chili powder, ground cumin, black beans, green bell pepper, flour tortillas, green onions, cheddar cheese, light sour cream, salsa]",burrito
Paleo-Breakfast-Burritos-1274226,Paleo Breakfast Burritos,4,900.0,[Breakfast and Brunch],,"[eggs, salt, garlic powder, cheese, avocado oil, luncheon meat]",burrito
Breakfast-Burrito-1043251,Breakfast Burrito,4,2100.0,[Breakfast and Brunch],,"[rolls, bacon, eggs, Potatoes O'Brien, green onions, shredded cheddar cheese, flour tortillas, salsa]",burrito
Steak-Burritos-TasteOfHome,Steak Burritos,5,29700.0,[Main Dishes],[Mexican],"[flank steak, taco seasoning, onions, green chilies, vinegar, flour tortillas, shredded Monterey Jack cheese, plum tomatoes, sour cream]",burrito
Spanish-Rice-and-Beef-Burritos-1249245,Spanish Rice and Beef Burritos,4,1800.0,[Main Dishes],,"[lean ground beef, water, Knorr® Fiesta Sides Spanish Rice, Mexican cheese blend, large flour tortillas, black beans, guacamole, pico de gallo, cilantro]",burrito
Bean-Burritos-MyRecipes-237427,Bean Burritos,3,,[Main Dishes],"[American, Mexican]","[refried beans, salsa, long-grain rice, shredded cheddar cheese, flour tortillas]",burrito
