id,recipeName,rating,totalTimeInSeconds,course,cuisine,ingredients,dish
Black-Bean-Breakfast-Burritos-488656,Black Bean Breakfast Burritos,4,1500.0,[Breakfast and Brunch],,"[large eggs, milk, salt, pepper, cilantro leaves, black beans, feta cheese, avocado, salsa, soft taco size flour tortillas]",burrito
Skinny-Charred-Chicken_-Quinoa-and-Black-Bean-Burritos-1327211,"Skinny Charred Chicken, Quinoa and Black Bean Burritos",4,1500.0,[Main Dishes],,"[chicken breasts, ground chipotle chile pepper, red pepper, yellow peppers, echalion, agave nectar, cooked quinoa, black beans, salt, pepper, lime, fresh spinach, feta cheese, tortilla wraps, avocado, purple onion, chili flakes, cherry tomatoes, garlic, chopped parsley, spring onions]",burrito
Easy-Beef-Burrito-Skillet-1304492,Easy Beef Burrito Skillet,4,1500.0,[Main Dishes],,"[ground beef, taco seasoning, water, chunky salsa, black beans, Old El Paso Flour Tortillas, Mexican cheese blend, sour cream, sliced green onions]",burrito
Burrito-Lasagna-1181732,Burrito Lasagna,4,4800.0,[Main Dishes],[Southwestern],"[lean ground beef, yellow onion, garlic, ground cumin, ground cayenne pepper, green chilies, sliced black olives, diced tomatoes, taco sauce, refried beans, corn, flour tortillas, cheddar cheese]",burrito
Chicken-Vindaloo-Burritos-1285486,Chicken Vindaloo Burritos,3,5100.0,[Main Dishes],[Indian],"[white vinegar, red chili peppers, garlic, peeled fresh ginger, boneless skinless chicken breasts, garam masala, ground cumin, paprika, ground turmeric, ground coriander, ground black pepper, vegetable oil, onions, gold potatoes, tomato paste, homemade chicken stock, corn starch, kosher salt, basmati rice, tumeric, lemon, juice, large flour tortillas, large tomato, cilantro leaves, paneer cheese, mango chutney]",burrito
Pulled-Pork-Burritos-1230047,Pulled Pork Burritos,4,2100.0,[Main Dishes],,"[brown sugar, cheddar cheese, flour, lettuce, pork roast, salsa, sour cream]",burrito
Supreme-Grilled-Stuffed-Breakfast-Burritos-1303444,Supreme Grilled Stuffed Breakfast Burritos,4,2100.0,[Breakfast and Brunch],,"[bacon, large eggs, salt, black pepper, butter, yellow onion, green bell pepper, refried beans, colby jack cheese, sour cream, tortillas]",burrito
Knife-and-Fork-Breakfast-Burrito-630053,Knife-and-Fork Breakfast Burrito,3,2100.0,[Breakfast and Brunch],,"[canned black beans, chunky salsa, eggs, milk, black pepper, salt, nonstick spray, tomatoes, chees fresco queso, sour cream, fresh mint]",burrito
Egg-burritos-to-die-for-309683,Egg Burritos To Die For,5,3000.0,,[Mexican],"[eggs, red bell pepper, pepper, green chile, olive oil, Spike Seasoning, whole wheat tortillas, monterey jack, light sour cream, salsa]",burrito
Breakfast-Burrito-1290274,Breakfast Burrito,3,2100.0,[Breakfast and Brunch],,"[butter, eggs, milk, sausages, onions, tomatoes, spinach, mushrooms, fresh herbs, tortillas, grating cheese]",burrito
Maple-Sausage-Breakfast-Burritos-Allrecipes,Maple Sausage Breakfast Burritos,4,1500.0,[Breakfast and Brunch],[Mexican],"[flour tortillas, rolls, green pepper, green onions, eggs, cream cheese, grated jack cheese, salsa]",burrito
Slow-Cooker-Steak-Burritos-996583,Slow Cooker Steak Burritos,4,11100.0,[Main Dishes],,"[salsa, fat, top sirloin, salt, pepper, onion powder, cooking oil, tortillas, sour cream, cheese]",burrito
Carne-Asada-Burrito-Bowl-1279426,Carne Asada Burrito Bowl,4,2400.0,[Main Dishes],,"[carne asada, pico de gallo, basmati rice, water, butter, lime, cilantro, canned black beans, corn, grating cheese]",burrito
Whole-Wheat-Chicken-Celery-Burritos-1332479,Whole Wheat Chicken Celery Burritos,4,3300.0,[Main Dishes],,"[olive oil, onions, garlic, chicken breasts, red bell pepper, salt, pepper, refried beans, cheese, whole wheat tortillas]",burrito
Quinoa-Chicken-and-Black-Bean-Burritos-with-Chipotle-Guacamole-568504,Quinoa Chicken and Black Bean Burritos with Chipotle Guacamole,4,1800.0,[Main Dishes],"[Southwestern, Mexican]","[avocado, chipotle peppers, sour cream, lime, cilantro leaves, extra-virgin olive oil, garlic, chili powder, cumin, black beans, water, cooked quinoa, chicken, tortillas, shredded cheddar cheese, shredded lettuce]",burrito
Ham-and-Cheese-Breakfast-Burrito-Bites-1256875,Ham and Cheese Breakfast Burrito Bites,4,900.0,[Breakfast and Brunch],,"[eggs, ham, diced bell pepper, milk, dry mustard, kosher salt, cracked black pepper, cheddar cheese, large flour tortillas]",burrito
Burrito-Bowl-Stuffed-Peppers-1349052,Burrito Bowl Stuffed Peppers,4,3300.0,[Main Dishes],,"[bell pepper, ground turkey, onions, small tomatoes, corn kernels, black olives, black beans, salsa, fresh cilantro, cumin, avocado, fresh lime juice, salt, pepper]",burrito
Double-cheddar-_-chicken-burritos-297365,Double Cheddar & Chicken Burritos,4,2100.0,"[Lunch and Snacks, Main Dishes]",,"[ragu cheesi doubl cheddar sauc, red kidney beans, 2 1/2 to 3 lb. chicken, cut into serving pieces, regular or convert rice, flour tortillas, shredded cheddar cheese]",burrito
Confetti_stuffed-Burritos-My-Recipes,Confetti-Stuffed Burritos,4,,[Main Dishes],[Southwestern],"[sweet potatoes, low salt chicken broth, chopped onion, garlic cloves, corn kernels, canned black beans, red bell pepper, fresh cilantro, fresh lime juice, refried beans, flour tortillas, non-fat sour cream, salsa, chopped cilantro fresh]",burrito
Mexican-style-rice-_-bean-burritos-299792,Mexican-style Rice & Bean Burritos,4,1200.0,[Main Dishes],[Mexican],"[Knorr® Chicken Flavor Rice Sides™, water, I Can't Believe It's Not Butter!® Spread, red bell pepper, sliced, sliced green onions, red kidney beans, shredded Monterey Jack cheese, flour tortillas]",burrito
Not-Your-Typical-Breakfast-Burrito-1234055,Not Your Typical Breakfast Burrito,4,1200.0,[Breakfast and Brunch],,"[large eggs, large egg whites, onions, roasted red peppers, spinach, low-fat swiss cheese, whole wheat tortillas, salt, pepper]",burrito
Baked-Burritos-1105974,Baked Burritos,4,2700.0,[Main Dishes],,"[meat, low sodium beef broth, taco seasoning, corn starch, shredded sharp cheddar cheese, fat-free refried beans, whole wheat tortillas, cheese, chili powder, garlic powder, onion powder, crushed red pepper flakes, dried oregano, paprika, ground cumin, salt, black pepper]",burrito
Mexican-Breakfast-Burritos-1096026,Mexican Breakfast Burritos,3,1020.0,[Breakfast and Brunch],[Mexican],"[no-salt-added black beans, fresh lime juice, cooking spray, large eggs, flour tortillas, salsa, cotija, lime wedges]",burrito
Roasted-Chickpea-and-Broccoli-Burrito-1248552,Roasted Chickpea and Broccoli Burrito,3,3300.0,[Main Dishes],,"[chickpeas, yellow onion, red bell pepper, broccoli, olive oil, low sodium soy sauce, chili powder, ground cumin, smoked paprika, ground coriander, black pepper, garlic, lime, flour tortillas]",burrito
