id,recipeName,rating,totalTimeInSeconds,course,cuisine,ingredients
Mini-Caramel-Streusel-Cakes-1374463,Mini Caramel Streusel Cakes,4,2400.0,[Desserts],,"[yellow cake mix, brown sugar, cinnamon, unsalted butter, cream cheese, milk, large eggs, caramel bits]"
Kransekake-Birthday-Cake-1372802,Kransekake Birthday Cake,4,9000.0,[Desserts],,"[ground almonds, egg whites, powdered sugar, icing, sprinkles, edible glitter]"
The-Best-Coconut-Pecan-Pudding-Cake-1379131,The Best Coconut Pecan Pudding Cake,3,3000.0,[Desserts],,"[white cake mix, vanilla instant pudding, water, eggs, oil, coconut flakes, chopped pecans]"
Cranberry-Cobbler-Dump-Cake-1380463,Cranberry Cobbler Dump Cake,4,3900.0,[Desserts],,"[cooking spray, whole cranberry sauce, yellow cake mix, butter, granola cereal, Craisins]"
Crockpot-Chocolate-Dump-Cake-1372367,Crockpot Chocolate Dump Cake,4,2400.0,[Desserts],,"[devils food cake mix, chocolate pudding mix, sour cream, oil, water, eggs, chocolate chips]"
Butterfly-Cake-Recipe-Bake-with-Stork-1376592,Butterfly Cake Recipe – Bake with Stork,4,4800.0,[Desserts],,"[Stork, caster sugar, large eggs, self rising flour, vanilla extract, powdered sugar, food colouring]"
Lemon-Pound-Cake-1366895,Lemon Pound Cake,4,3900.0,[Desserts],,"[Duncan Hines® Signature Lemon Supreme Cake Mix, lemon flavor instant pudding mix, large eggs, water, vegetable oil, powdered sugar, fresh lemon juice]"
Light-Vanilla-Blueberry-Coffee-Cake-1375712,Light Vanilla Blueberry Coffee Cake,3,11400.0,[Breads],,"[flour, sugar, baking soda, baking powder, salt, cinnamon, eggs, vanilla yogurt, vegetable oil, vanilla extract, blueberries]"
French-Apple-Cake-1330475,French Apple Cake,4,6300.0,[Desserts],,"[granny smith apples, calvados, lemon juice, all-purpose flour, granulated sugar, baking powder, salt, eggs, egg yolks, vegetable oil, whole milk, vanilla extract, powdered sugar]"
Lemon-Lava-Cake-1363130,Lemon Lava Cake,3,3900.0,[Desserts],,"[lemon cake mix, lemon pudding, cold milk, sugar, water, lemon juice, powdered sugar]"
Chocolate-Cake-1371868,Chocolate Cake,4,4500.0,[Desserts],,"[chocolate cake mix, chocolate instant pudding, sour cream, vegetable oil, eggs, milk, vanilla, mini chocolate chips, powdered sugar, unsweetened cocoa powder, vanilla extract]"
Apple-Coffee-Cake-1373443,Apple Coffee Cake,4,3600.0,[Breads],,"[butter, brown sugar, eggs, flour, baking soda, ground cinnamon, ground ginger, salt, sour cream, pure vanilla extract, apples]"
Hot-Chocolate-Poke-Cake-1374911,Hot Chocolate Poke Cake,4,5400.0,[Desserts],,"[milk, hot chocolate mix, chocolate cake mix, large eggs, light sour cream, vegetable oil, vanilla extract, hot fudge topping, heavy whipping cream]"
One-Piece-Wont-Be-Enough-With-This-Coconut-Chocolate-Cake_-1378543,One Piece Won’t Be Enough With This Coconut Chocolate Cake.,4,3000.0,[Desserts],,"[chocolate cake mix, eggs, oil, water, cream of coconut, sweetened condensed milk, cool whip, shredded coconut]"
Layered-Vanilla-Pudding-Cake-with-Berry-Filled-Jello-Topping-1379157,Layered Vanilla Pudding Cake with Berry-Filled Jello Topping,3,1200.0,[Desserts],,"[vanilla cake mix, egg whites, water, butter, strawberry gelatin, strawberries, vanilla pudding]"
Snickerdoodle-Mug-Cake-1375361,Snickerdoodle Mug Cake,4,1500.0,[Desserts],,"[all-purpose flour, sugar, baking powder, cinnamon, milk, salted butter, pure vanilla extract]"
Reindeer-Snack-Cakes-1373682,Reindeer Snack Cakes,4,1800.0,[Desserts],,"[chocolate, cake, mini candy button eyes, pretzels]"
Yellow-Butter-Cake-1358798,Yellow Butter Cake,4,3000.0,"[Desserts, Afternoon Tea]",,"[cake flour, granulated sugar, baking powder, salt, unsalted butter, milk, large eggs, large egg whites, vanilla]"
Mama_s-7-Up-Pound-Cake-1377531,Mama's 7-Up Pound Cake,4,4500.0,"[Desserts, Afternoon Tea]",,"[unsalted butter, granulated sugar, salt, large eggs, cake flour, soda, lemon extract, confectioners sugar]"
Apple-Cake-1349987,Apple Cake,3,2700.0,[Desserts],,"[apples, yellow cake mix, sugar, ground cinnamon, butter]"
Layered-Yellow-Cake-with-Buttercream-frosting-and-Mint-Chocolate-Shavings-1379139,Layered Yellow Cake with Buttercream frosting and Mint Chocolate Shavings,3,3000.0,[Desserts],,"[yellow cake mix, powdered sugar, butter, vanilla, milk, chocolate]"
Dairy-Free-Freezer-Cake-1368280,Dairy Free Freezer Cake,4,,,,"[vanilla beans, frozen desserts, cookie crumbs, full fat coconut milk, powdered sugar, pure vanilla extract]"
Red-Velvet-Poke-Cake-1378496,Red Velvet Poke Cake,4,2100.0,[Desserts],,"[red velvet cake mix, chocolate instant pudding, milk, frozen whipped topping]"
Charcoal-Chocolate-Chiffon-Cake-1379490,Charcoal Chocolate Chiffon Cake,4,6300.0,[Desserts],,"[egg yolks, caster sugar, vegetable oil, cake flour, salt, dark chocolate, egg whites]"
Peach-Dump-Cake-1369248,Peach Dump Cake,3,4140.0,[Desserts],,"[peach slices, yellow cake mix, chopped walnuts, butter]"
Confetti-Mug-Cake-1357659,Confetti Mug Cake,3,480.0,[Desserts],,"[yellow cake mix, water, unsweetened applesauce, eggs, candy sprinkles, frosting, cocktail cherries]"
Buttercream-Chocolate-Layer-Cake-1379137,Buttercream Chocolate Layer Cake,3,2700.0,[Desserts],,"[devil's food cake mix, chocolate instant pudding, sour cream, vegetable oil, eggs, milk, vanilla, mini chocolate chips, frosting, shortening, powdered sugar, salt, heavy whipping cream]"
Snickerdoodle-Mug-Cake-1361991,Snickerdoodle Mug Cake,4,1800.0,[Desserts],,"[all-purpose flour, milk, sugar, unsalted butter, baking powder, cinnamon, vanilla extract]"
Banana-Butterscotch-Pecan-Cake-1374319,Banana Butterscotch Pecan Cake,4,3600.0,[Desserts],,"[bananas, white sugar, eggs, melted butter, rice flour, corn starch, baking soda, baking powder, milk, whipped cream, instant butterscotch pudding mix, pecans, maple syrup]"
Tropical-Dump-Cake-1365739,Tropical Dump Cake,3,3900.0,[Desserts],,"[crushed pineapple, white cake mix, butter, pecans, ice cream]"
No-Bake-Strawberry-Cream-Cake-1377836,No Bake Strawberry Cream Cake,3,10800.0,[Desserts],,"[pie crust, strawberries, corn starch, sugar, whipped cream]"
Chocolate-Banana-Cake-1374638,Chocolate Banana Cake,4,4500.0,[Desserts],,"[all-purpose flour, unsweetened cocoa powder, baking soda, baking powder, salt, sugar, butter, large eggs, bananas, pure vanilla extract, milk, chocolate chips]"
Madeira-Cake-1371800,Madeira Cake,4,2400.0,[Desserts],,"[eggs, sugar, margarine, lemon, vanilla essence, cake flour, baking powder, milk]"
Snickers-Poke-Cake-1363963,Snickers Poke Cake,4,3300.0,[Desserts],,"[chocolate cake mix, caramels, butter, milk, chopped pecans, morsels]"
Cream-Cheese-Pound-Cake-1376301,Cream Cheese Pound Cake,4,3900.0,[Desserts],,"[butter, cream cheese, sugar, eggs, vanilla, all-purpose flour, baking powder]"
4-Ingredient-Molten-Nutella-Lava-Mug-Cake-1370088,4 Ingredient Molten Nutella Lava Mug Cake,4,1200.0,[Desserts],,"[flour, baking powder, Nutella, fat free milk]"
Blueberry-Dump-Cake-1363126,Blueberry Dump Cake,3,1500.0,[Desserts],,"[blueberry pie filling, yellow cake mix, butter, chopped walnuts]"
Apple-Cider-Coffee-Cake-1373697,Apple Cider Coffee Cake,4,5400.0,"[Breads, Afternoon Tea]",,"[apple cider, active dry yeast, large eggs, milk, granulated sugar, unsalted butter, vanilla extract, salt, all-purpose flour, apple butter, powdered sugar, ground cinnamon]"
Pumpkin-Crumble-Cake-1377693,Pumpkin Crumble Cake,3,3600.0,[Desserts],,"[yellow cake mix, water, vegetable oil, pumpkin pie spice, eggs, pumpkin, chopped pecans, brown sugar, Gold Medal All Purpose Flour, butter, whipped cream, ground cinnamon, crystallized ginger]"
Chocolate-Lover_s-Fudge-Cake-1369254,Chocolate Lover's Fudge Cake,3,1800.0,[Desserts],,"[butter, brown sugar, eggs, unsweetened chocolate, buttermilk, vanilla, boiling water, baking soda, flour, frosting]"
Mashed-Potato-Cakes-with-Spinach-and-Cheese-1373459,Mashed Potato Cakes with Spinach and Cheese,4,2100.0,[Side Dishes],,"[mashed potatoes, olive oil, garlic, onions, fresh spinach, salt, pepper, cheddar cheese, eggs, butter, panko breadcrumbs]"
Carrot-Cake-Smoothie-Bowls-1372407,Carrot Cake Smoothie Bowls,4,300.0,[Beverages],,"[carrots, frozen banana, pumpkin purée, vanilla almondmilk, greek yogurt, cinnamon, ground nutmeg, salt, sunflower seeds, pumpkin seeds, chopped walnuts, shredded coconut, shredded carrots]"
Pumpkin-Better-Than-Sex-Cake-1355445,Pumpkin Better Than Sex Cake,4,3600.0,[Desserts],,"[yellow cake mix, pumpkin purée, pumpkin pie spice, sweetened condensed milk, cool whip, caramel sauce]"
Raspberry-Thumbprint-Cookie-Cake-1378514,Raspberry Thumbprint Cookie Cake,3,7200.0,[Desserts],,"[french vanilla cake mix, milk, butter, sour cream, large eggs, almond extract, raspberry jam, powdered sugar]"
Strawberry-Filled-Angel-Food-Cake-1380604,Strawberry Filled Angel Food Cake,4,2400.0,[Desserts],,"[angel food cake, strawberries, corn starch, cold water, powdered sugar]"
Chocolate-Brownie-Cake-1372909,Chocolate Brownie Cake,4,4500.0,[Desserts],,"[chocolate cake mix, fudge brownie mix, eggs, water, oil, heavy whipping cream, semi-sweet chocolate morsels]"
Black-Midnight-Chocolate-Cake-1379884,Black Midnight Chocolate Cake,3,3300.0,[Desserts],,"[dark chocolate cocoa powder, hot brewed coffee, cayenne, shortening, olive oil, sugar, eggs, buttermilk, vanilla, cake flour, salt, baking soda, baking powder, butter, cake, cocoa, confectioners sugar]"
No-Bake-Eclair-Cake-1370270,No-Bake Eclair Cake,3,2400.0,[Desserts],,"[graham crackers, vanilla instant pudding, whole milk, cool whip, unsweetened cocoa powder, powdered sugar, salted butter]"
2-Ingredient-Flourless-Nutella-Mug-Cake-1374715,2 Ingredient Flourless Nutella Mug Cake,4,240.0,[Desserts],,"[large eggs, Nutella]"
Blackap-Upside-Down-Cake-1377572,Blackap Upside Down Cake,4,1200.0,[Desserts],,"[brown sugar, butter, cake, white sugar, unsalted butter, eggs, all-purpose flour, baking powder, salt, almond milk, vanilla extract]"
Pumpkin-Crunch-Cake-1377365,Pumpkin Crunch Cake,4,4500.0,[Desserts],,"[pumpkin, evaporated milk, cinnamon, sugar, eggs, cake mix, chopped nuts, butter, cream cheese, cool whip, powdered sugar]"
Easy-Pear-Cobbler-a_k_a_-Pear-Dump-Cake-1378979,Easy Pear Cobbler a.k.a. Pear Dump Cake,3,3000.0,[Desserts],,"[yellow cake mix, butter, pears in heavy syrup, ground ginger]"
Mascarpone-Olive-Oil-Banana-Bread-Bundt-Cake-1374549,Mascarpone Olive Oil Banana Bread Bundt Cake,4,3000.0,[Desserts],,"[extra-virgin olive oil, cane sugar, coconut sugar, large eggs, vanilla extract, bananas, ricotta cheese, mascarpone, all-purpose flour, sea salt, baking soda, baking powder, lemon, lemon juice, powdered sugar, basil leaves, basil]"
Choco-Holic-Cake-1375792,Choco-Holic Cake,3,4200.0,[Desserts],,"[cake, chocolate cake mix, chocolate instant pudding and pie filling mix, milk, sour cream, large eggs, semi-sweet chocolate morsels, chopped walnuts, glaze, unsweetened chocolate, butter, powdered sugar, water, vanilla extract]"
Coconut-Cake-1357009,Coconut Cake,4,4200.0,[Desserts],,"[white cake mix, coconut, sour cream, vegetable oil, eggs, milk, vanilla, sweetened coconut flakes, butter, powdered sugar]"
BTS-Cake-or-Poke-Cake-1371173,BTS Cake or Poke Cake,4,1800.0,[Desserts],,"[chocolate cake, sweetened condensed milk, cool whip, toffee bits, caramels]"
Eggnog-Coffee-Cake-1377190,Eggnog Coffee Cake,4,2700.0,[Breads],,"[crumb topping, brown sugar, sugar, flour, nutmeg, butter, cake, eggnog, sour cream, eggs, vanilla, baking powder, baking soda, salt]"
Eggnog-Cake-1364677,Eggnog Cake,3,3480.0,[Desserts],,"[all-purpose flour, baking soda, baking powder, nutmeg, clove, vegetable oil, large eggs, Dixie Crystals Extra Fine Granulated Sugar, salt, bourbon whiskey, eggnog]"
Funfetti-Cake-Batter-Cookies-1362082,Funfetti Cake Batter Cookies,4,1800.0,[Desserts],,"[vanilla cake mix, baking powder, eggs, vegetable oil, vanilla extract, sprinkles]"
Dump-Cake-1350115,Dump Cake,4,2700.0,[Desserts],,"[crushed pineapples in juice, cherry pie filling, chopped nuts, yellow cake mix, butter]"
Andes-Mint-Cake-1378272,Andes Mint Cake,4,3900.0,[Desserts],,"[devil's food cake mix, eggs, oil, buttermilk, sour cream, vanilla extract, butter, peppermint extract, powdered sugar, unsweetened cocoa powder, milk, sugar, chocolate chips, heavy whipping cream]"
Simple-White-Cake-1368171,Simple White Cake,4,3900.0,[Desserts],,"[white sugar, butter, vanilla extract, eggs, all-purpose flour, baking powder, milk]"
Two-Ingredient-Pineapple-Angel-Food-Cake-1374406,Two-Ingredient Pineapple Angel Food Cake,4,5100.0,[Desserts],,"[angel food cake mix, crushed pineapples in juice]"
3_-Orange-Loaf-Cake-1360913,3. Orange Loaf Cake,4,2700.0,[Desserts],,"[cake flour, sugar, baking powder, salt, vegetable oil, orange juice, orange, egg whites, confectioners sugar]"
No-Bake-Cake-Batter-Cake-Balls-1360116,No-Bake Cake Batter Cake Balls,3,900.0,[Desserts],,"[unsalted butter, sugar, all-purpose flour, yellow cake mix, vanilla, milk, sprinkles, almonds]"
Pumpkin-Cheesecake-1375760,Pumpkin Cheesecake,4,6300.0,[Desserts],,"[graham cracker crumbs, butter, sugar, cream cheese, vanilla, solid pack pumpkin, eggs, cinnamon, nutmeg, allspice, whipped cream]"
MELT-_-MIX-HONEY-CAKE-1377868,MELT & MIX HONEY CAKE,4,4200.0,"[Desserts, Afternoon Tea]",,"[self raising flour, caster sugar, honey, unsalted butter, large eggs, sour cream, sliced almonds]"
Carrot-Cake-1374249,Carrot Cake,4,2700.0,[Desserts],,"[canola oil, sugar, large eggs, cinnamon, vanilla, grated carrot, flour, baking powder, chopped walnuts, cream cheese, butter, powdered sugar]"
Blueberry-Crumb-Cake-1364296,Blueberry Crumb Cake,4,3900.0,[Breads],,"[butter, sugar, eggs, vanilla extract, all-purpose flour, baking powder, salt, whole milk, fresh blueberries, cinnamon, flour]"
Vanilla-Custard-Magic-Cake-1379678,Vanilla Custard Magic Cake,3,1500.0,[Desserts],,"[large eggs, caster sugar, vanilla bean paste, butter, plain flour, milk, powdered sugar]"
Bienmesabe-Cake-1371625,Bienmesabe Cake,3,6300.0,[Desserts],,"[large eggs, sugar, cake flour, baking powder, pure vanilla extract, milk, coconut milk, large egg yolks, sweetened coconut flakes, corn starch, water, coconut rum, large egg whites]"
Chocolate-Blackout-Cake-1354478,Chocolate Blackout Cake,3,4200.0,"[Afternoon Tea, Desserts]",,"[cake, all-purpose flour, cocoa powder, baking soda, salt, baking powder, sugar, dark brown sugar, unsalted butter, buttermilk, large eggs, vanilla extract, bittersweet chocolate, frosting, cream cheese, powdered sugar]"
Homemade-Angel-Food-Cake-1356862,Homemade Angel Food Cake,4,2100.0,[Desserts],,"[cake flour, granulated sugar, cream of tartar, salt, eggs, vanilla]"
Cherry-Dump-Cake-1359653,Cherry Dump Cake,3,4500.0,[Desserts],,"[crushed pineapples in juice, Duncan Hines Comstock® Country Cherry, Duncan Hines Classic Yellow Cake Mix, chopped pecans, butter]"
Famous-Brick-Street-Chocolate-Cake-1363738,Famous Brick Street Chocolate Cake,4,4800.0,[Desserts],,"[sugar, butter, pure vanilla extract, large eggs, cake flour, cocoa, baking soda, salt, chocolate instant pudding, buttermilk, semi-sweet chocolate morsels, water, vanilla, powdered sugar, heavy cream]"
Lemon-Layered-Chiffon-Cake-1379162,Lemon Layered Chiffon Cake,3,3000.0,[Desserts],,"[flour, baking powder, salt, granulated sugar, vegetable oil, large eggs, cold water, lemon juice, lemon zest, cream of tartar]"
SNICKERS-Cake_-SNICKERS-Ice-Cream-Bars-Cake-1376298,SNICKERS Cake! SNICKERS Ice Cream Bars Cake,4,3900.0,[Desserts],,"[Snickers Ice Cream Bars, whipped cream, chocolate syrup, caramel syrup, M&M's Candy]"
Oreo-Cake-1336113,Oreo Cake,4,3900.0,[Desserts],,"[devil's food cake mix, chocolate instant pudding, eggs, milk, oil, sour cream, vanilla extract, butter, cream cheese, powdered sugar]"
Classic-Pound-Cake-1122817,Classic Pound Cake,4,6000.0,[Desserts],,"[unsalted butter, eggs, egg yolks, vanilla extract, salt, granulated sugar, cake flour]"
Dutch-Butter-Cake-1365421,Dutch Butter Cake,4,3000.0,[Desserts],,"[butter, white sugar, eggs, baking powder, salt, vanilla extract, milk, sliced almonds]"
Butterfinger-Cake-1351010,Butterfinger Cake,4,2700.0,[Desserts],,"[german chocolate cake mix, Butterfinger Candy Bars, caramel ice cream topping, sweetened condensed milk, cool whip, chocolate syrup]"
Cream-Cheese-Chiffon-Cake-1374790,Cream Cheese Chiffon Cake,4,6300.0,[Desserts],,"[egg yolks, caster sugar, vegetable oil, cake flour, salt, Philadelphia Cream Cheese, milk, egg whites]"
Best-Easy-Dump-Cake-Ever-1376428,Best Easy Dump Cake Ever,4,3600.0,[Desserts],,"[cherry pie filling, crushed pineapple, yellow cake mix, butter, shredded coconut, nuts]"
Easy-Peach-Dump-Cake-1371698,Easy Peach Dump Cake,4,2400.0,[Desserts],,"[peaches, yellow cake mix, butter]"
Pumpkin-Pecan-Cake-1375020,Pumpkin Pecan Cake,4,3900.0,[Desserts],,"[pumpkin purée, evaporated low-fat milk, brown sugar, eggs, pumpkin pie spice, cinnamon, salt, yellow cake mix, butter, chopped pecans, whipped cream, whipped topping]"
Pumpkin-Toffee-Poke-Cake-1372591,Pumpkin Toffee Poke Cake,4,9900.0,[Desserts],,"[vanilla cake mix, pumpkin purée, pumpkin pie spice, caramel sauce, whipped topping, toffee]"
Jello-Topping-Chocolate-Cake-Filled-With-Raspberry-Cream-1379149,Jello Topping Chocolate Cake Filled With Raspberry Cream,3,1500.0,[Desserts],,"[cake, chocolate cake mix, butter, sugar, fresh raspberries, granulated sugar, lemon juice, cream cheese, whipped topping, gelatin, raspberries]"
Pumpkin-Dump-Cake-1346022,Pumpkin Dump Cake,4,3600.0,[Desserts],,"[vanilla cake mix, evaporated milk, eggs, brown sugar, ground cinnamon, pumpkin purée, butter]"
Chocolate-Italian-Sponge-Cake-1340586,Chocolate Italian Sponge Cake,4,3600.0,[Desserts],[Italian],"[granulated sugar, extra large eggs, cake flour, unsweetened cocoa powder]"
Better-Than-Sex-Cake-1379064,Better Than Sex Cake,4,7200.0,[Desserts],,"[chocolate cake, caramel sauce, sweetened condensed milk, heavy whipping cream, vanilla extract, sugar, Heath Candy Bars, corn syrup, water, cream, unsalted butter, salt, all-purpose flour, cocoa powder, boiling water, buttermilk, large eggs, baking soda, butter powder]"
Pumpkin-Praline-Cake-1367678,Pumpkin Praline Cake,4,2280.0,[Desserts],,"[yellow cake mix, pumpkin purée, whole milk, vegetable oil, large eggs, chopped pecans, nutmeg, cinnamon, sweetened condensed milk, unsalted butter]"
Banana-Cake-1371919,Banana Cake,4,6300.0,[Desserts],,"[flour, sugar, salt, eggs, butter, bananas, lemon, sour cream]"
Cranberry-Pomegranate-Pound-Cake-With-Orange-Cream-Cheese-Glaze-1368107,Cranberry Pomegranate Pound Cake With Orange Cream Cheese Glaze,4,4200.0,[Desserts],,"[butter, granulated sugar, large eggs, orange, vanilla extract, buttermilk, salt, baking powder, all-purpose flour, frozen cranberries, pomegranate seeds, cream, powdered sugar]"
Blueberry-Lavender-Cake-1365042,Blueberry Lavender Cake,4,5400.0,"[Afternoon Tea, Desserts]",,"[unsalted butter, granulated sugar, eggs, egg yolks, vanilla extract, cake flour, baking powder, baking soda, salt, 2% reduced-fat milk, fresh blueberries, water, dried lavender, confectioners sugar]"
Apple-Cake-1345929,Apple Cake,4,4200.0,[Desserts],,"[eggs, coconut oil, applesauce, sugar, vanilla, all-purpose flour, ground cinnamon, salt, baking soda, granny smith apples]"
Pumpkin-Gooey-Butter-Cakes-1369154,Pumpkin Gooey Butter Cakes,4,4800.0,[Desserts],,"[cake, yellow cake mix, eggs, butter, cream cheese, pumpkin purée, vanilla, powdered sugar, cinnamon, nutmeg]"
Slow-Cooker-Apple-Spice-Dump-Cake-1378687,Slow Cooker Apple-Spice Dump Cake,4,2400.0,[Desserts],,"[sliced apples, spice cake mix, butter, pecans, brown sugar, oats]"
Cranberry-Pecan-Coffee-Cake-1374104,Cranberry-Pecan Coffee Cake,4,4200.0,[Breads],,"[unsalted butter, sugar, vanilla, eggs, flour, baking powder, baking soda, sour cream, fresh cranberries, salted butter, brown sugar, pumpkin pie spice, chopped pecans, powdered sugar, milk]"
Extreme-Lemon-Cake-1373207,Extreme Lemon Cake,4,2700.0,[Desserts],,"[lemon cake mix, lemon pudding, large eggs, sour cream, lemon extract, lemon, vegetable oil, powdered sugar, fresh lemon juice]"
2-Ingredient-Spiced-Mug-Cake-1376197,2 Ingredient Spiced Mug Cake,4,120.0,[Desserts],,"[spice cake mix, angel food cake mix]"
Lemon-Sugar-Snaps-1377605,Lemon Sugar Snaps,3,2040.0,[Desserts],,"[butter, eggs, lemon cake mix, yellow corn meal, lemon peel, coarse sugar]"
Gooey-Pumpkin-Butter-Cake-1374736,Gooey Pumpkin Butter Cake,4,3300.0,[Desserts],,"[yellow cake mix, eggs, butter, cream cheese, pumpkin pie filling, vanilla extract, powdered sugar]"
Funfetti-cake-335501,Funfetti Cake,5,3600.0,[Desserts],,"[cake flour, baking powder, salt, buttermilk, egg whites, sugar, lemon zest, butter, lemon extract, rainbow sprinkles]"
Apple-Cranberry-Dump-Cake-1361076,Apple Cranberry Dump Cake,4,3900.0,[Desserts],,"[apple pie filling, whole cranberry sauce, yellow cake mix, butter, chopped walnuts]"
Easter-Candy-Cake-1352145,Easter Candy Cake,4,1500.0,[Desserts],,"[cake, icing, Peeps, candy]"
Cannoli-Cake-1379474,Cannoli Cake,4,4500.0,[Desserts],,"[eggs, sugar, all-purpose flour, butter, semisweet chocolate, ricotta, frosting, fresh berries, part-skim ricotta cheese, vanilla, whipping cream, semi sweet mini chocolate chips, confectioners sugar]"
Cinnamon-Peach-Cake-1376849,Cinnamon Peach Cake,4,3000.0,"[Desserts, Afternoon Tea]",,"[unsalted butter, brown sugar, large eggs, vanilla, all-purpose flour, baking soda, salt, cinnamon, buttermilk, peaches, sugar]"
Apple-Crumble-Cake-1350303,Apple Crumble Cake,4,3000.0,[Desserts],,"[apples, all-purpose flour, granulated sugar, baking powder, salt, whole milk, large eggs, melted butter, raw cane sugar, butter, cinnamon]"
Peppermint-Poke-Cake-1359695,Peppermint Poke Cake,4,4500.0,[Desserts],,"[cake mix, fudge, chocolate instant pudding, cold milk, peppermint extract, peppermint, cool whip]"
Christmas-Cake-Tray-Bake-1370772,Christmas Cake Tray Bake,3,4200.0,[Desserts],,"[butter, golden caster sugar, small eggs, plain flour, dried fruit, mixed spice, apricot jam, marzipan, powdered sugar, sugar, cake]"
Easy-Crock-Pot-Pumpkin-Crumb-Cake-1376359,Easy Crock Pot Pumpkin Crumb Cake,3,,,,"[cake mix, water, eggs, solid pack pumpkin, vanilla, mini chocolate chips, chopped walnuts]"
Classic-Strawberry-Cake-1364672,Classic Strawberry Cake,3,2700.0,[Desserts],,"[white cake mix, all-purpose flour, eggs, cooking oil, water, strawberry gelatin, strawberries, butter, Dixie Crystals Confectioners Powdered Sugar]"
Angel-Food-Cake-579912,Angel Food Cake,3,4800.0,"[Desserts, Afternoon Tea]",,"[egg whites, vanilla extract, almond extract, cream of tartar, kosher salt, sugar, cake flour]"
Rainbow-Cake-Roll-1360564,Rainbow Cake Roll,3,7200.0,[Desserts],,"[large eggs, white cake mix, sour cream, water, vegetable oil, food colouring, powdered sugar, frosting, frozen whipped topping, candy]"
Nanas-Easy-Lemon-Pound-Cake-1345061,Nana’s Easy Lemon Pound Cake,4,3300.0,[Desserts],,"[lemon cake mix, eggs, instant pudding mix, milk, confectioners sugar]"
Death-by-Chocolate-Cake-1356407,Death by Chocolate Cake,4,4800.0,[Desserts],,"[unsweetened chocolate, unsweetened dutch process cocoa, water, unsalted butter, dark brown sugar, large eggs, sour cream, vanilla extract, all-purpose flour, cake flour, baking powder, fine sea salt, powdered sugar, unsweetened cocoa powder, milk, dark chocolate, heavy cream, OREO® Cookies, chocolate wafer, chocolate bars, Reese's Peanut Butter Cups, Hershey's Kisses]"
Heath-Bar-Poke-Cake-1371674,Heath Bar Poke Cake,4,2100.0,[Desserts],,"[yellow cake mix, sweetened condensed milk, cool whip, caramel topping, Heath Candy Bars]"
Cake-Batter-Christmas-Cookies-1378970,Cake Batter Christmas Cookies,4,900.0,[Desserts],,"[vanilla cake mix, baking powder, eggs, vegetable oil, vanilla extract, sprinkles]"
One-Bowl-Mini-Cranberry-Dump-Cakes-1378780,One Bowl Mini Cranberry Dump Cakes,4,2700.0,[Desserts],,"[flour, sugar, salt, fresh cranberries, chopped walnuts, butter, eggs, almond extract]"
Three-Ingredient-Low-Fat-Creamsicle-Cake-1058647,Three Ingredient Low-Fat Creamsicle Cake,3,2400.0,[Desserts],,"[white cake mix, nonfat greek yogurt, orange juice, grated orange, powdered sugar]"
One-Bowl-Mini-Cranberry-Dump-Cakes-1378204,One Bowl Mini Cranberry Dump Cakes,4,2700.0,[Desserts],,"[flour, sugar, salt, fresh cranberries, chopped walnuts, butter, eggs, almond extract]"
Rich-Chocolate-Pound-Cake-1375794,Rich Chocolate Pound Cake,3,4200.0,"[Desserts, Afternoon Tea]",,"[semi-sweet chocolate morsels, all-purpose flour, baking powder, salt, light brown sugar, butter, vanilla extract, large eggs, milk]"
Chocolate-Cake-Extraordinaire-1378650,Chocolate Cake Extraordinaire,4,6300.0,[Desserts],,"[flour, eggs, salt, powdered sugar, semi-sweet chocolate morsels, butter, vanilla]"
Upside-Down-Pineapple-Cake-1365898,Upside Down Pineapple Cake,3,4200.0,[Desserts],,"[pineapple, butter, granulated sugar, eggs, self raising flour, milk, honey]"
Cake-Pop-1334271,Cake Pop,4,4200.0,[Desserts],,"[cake mix, frosting, candy melts, crisco, lollipop, sprinkles]"
Apple-Fritter-Cakes-1370355,Apple Fritter Cakes,4,3600.0,"[Desserts, Afternoon Tea]",,"[light brown sugar, granulated sugar, ground cinnamon, salt, unsalted butter, all-purpose flour, baking powder, large eggs, vanilla extract, apple cider, apples, ground nutmeg, confectioners sugar, vanilla bean paste]"
Hickory-Nut-Cake-1378226,Hickory Nut Cake,4,2700.0,[Desserts],,"[shortening, sugar, eggs, cake flour, salt, baking powder, milk, hickory nuts, vanilla, brown sugar, whole milk cream, butter]"
Cake-Souffle-1373478,Cake Soufflé,4,3600.0,[Desserts],,"[chicken, sugar, flour, butter, gelatin, condensed milk, vanilla sugar]"
Pumpkin-Pecan-Crunch-Cake-1372101,Pumpkin Pecan Crunch Cake,4,3900.0,[Desserts],,"[pumpkin purée, whole milk, eggs, sugar, cinnamon, butter, yellow cake mix, pecans, heavy cream]"
Butterfinger-Bomb-Cake-1338295,Butterfinger Bomb Cake,4,3000.0,[Desserts],,"[chocolate cake mix, sour cream, caramel ice cream topping, whipped topping, butterfinger]"
