id,recipeName,rating,totalTimeInSeconds,course,cuisine,ingredients
Almond-Snowball-Cookies-1377147,Almond Snowball Cookies,4,1680.0,[Desserts],,"[unsalted butter, cookies, powdered sugar, vanilla, all-purpose flour, fine salt, almond meal, orange zest]"
Cashew-Brickle-Cookies-1377606,Cashew-Brickle Cookies,3,2700.0,[Desserts],,"[refrigerated sugar cookie dough, cashew nuts, toffee bits]"
Sugar-Cookie-1359846,Sugar Cookie,4,2100.0,[Desserts],,"[salted butter, powdered sugar, eggs, vanilla extract, all-purpose flour, baking powder, salt]"
Twix-Cookies-1375058,Twix Cookies,4,2400.0,[Desserts],,"[softened butter, powdered sugar, flour, vanilla, salt, caramels, evaporated milk, milk, shortening]"
Grandmas-Soft-Sugar-Cookies-1371051,Grandma’s Soft Sugar Cookies,4,1800.0,[Desserts],,"[large eggs, vegetable oil, vanilla, white sugar, flour, baking powder, salt]"
Peanut-Butter-Pecan-Cluster-Cookies-1377431,Peanut Butter Pecan Cluster Cookies,4,9300.0,[Desserts],,"[butter, peanut butter, brown sugar, granulated sugar, eggs, vanilla extract, milk, salt, baking soda, all-purpose flour, pecans]"
Oatmeal-Cookies-1374573,Oatmeal Cookies,4,1200.0,[Desserts],,"[sugar, butter, raisins, oatmeal, eggs, soda, flour, cinnamon, salt]"
Pudding-Chip-Cookies-1375878,Pudding Chip Cookies,3,1800.0,[Desserts],,"[all-purpose flour, chocolate pudding mix, vanilla, butter, brown sugar, baking soda, large eggs, large egg whites, semi sweet chocolate mini morsels]"
Chocolate-Vanilla-Swirl-Icebox-Cookies-1375059,Chocolate Vanilla Swirl Icebox Cookies,4,4320.0,[Desserts],,"[unsalted butter, granulated sugar, powdered sugar, large egg yolks, vanilla extract, all-purpose flour, salt, dark chocolate, Dutch-processed cocoa powder]"
Thin-Mint-Cookies-From-Scratch-1374238,Thin Mint Cookies From Scratch,4,6000.0,[Desserts],,"[all-purpose flour, unsweetened cocoa powder, baking soda, salt, baking powder, granulated sugar, butter, large eggs, vanilla extract, peppermint extract, confectioners sugar, semi-sweet chocolate morsels]"
Chocolate-Pecan-Pie-Cookies-1369656,Chocolate Pecan Pie Cookies,4,4200.0,[Desserts],,"[chocolate cookie, butter, light brown sugar, granulated sugar, vanilla extract, large eggs, all-purpose flour, unsweetened cocoa powder, baking soda, salt, cookies, pecans, brown sugar, corn syrup, eggs]"
Buttery-Jam-Thumbprint-Cookies-1378362,Buttery Jam Thumbprint Cookies,4,2100.0,[Desserts],,"[salted butter, powdered sugar, pure vanilla extract, table salt, all-purpose flour, preserves]"
Flourless-Fudge-Cookies-1371346,Flourless Fudge Cookies,4,2100.0,[Desserts],,"[powdered sugar, sea salt, cocoa powder, eggs, vanilla extract]"
Cranberry-Orange-Shortbread-Cookies-1376694,Cranberry Orange Shortbread Cookies,4,8400.0,[Desserts],,"[all-purpose flour, sugar, butter, almond extract, orange, dried cranberries]"
Soft-Buttermilk-Sugar-Cookies-1368230,Soft Buttermilk Sugar Cookies,4,600.0,[Desserts],,"[buttermilk, baking soda, salted butter, granulated sugar, eggs, salt, vanilla extract, all-purpose flour, baking powder, frosting, sprinkles]"
Eggnog-Cookies-1373647,Eggnog Cookies,4,3000.0,[Desserts],,"[flour, baking powder, salt, nutmeg, cinnamon, butter, brown sugar, sugar, large eggs, eggnog, vanilla extract, rum extract, powdered sugar]"
Cookies-and-Cream-Cookies-679661,Cookies and Cream Cookies,4,1620.0,[Desserts],[Kid-Friendly],"[all-purpose flour, baking soda, baking powder, butter, white sugar, eggs, vanilla extract, OREO® Cookies]"
Secret-Kiss-Snowball-Cookies-1370640,Secret Kiss Snowball Cookies,4,1800.0,[Desserts],,"[butter, granulated sugar, vanilla extract, flour, cocoa powder, Hershey's Kisses, powdered sugar]"
Chocolate-Chip-Cookies-1374583,Chocolate Chip Cookies,3,1200.0,[Desserts],,"[flour, baking soda, salt, ground cinnamon, butter, brown sugar, granulated sugar, eggs, vanilla extract, semi-sweet chocolate morsels, chopped nuts]"
Flourless-Hot-Chocolate-Cookies-1375207,Flourless Hot Chocolate Cookies,4,1500.0,[Desserts],,"[powdered sugar, unsweetened cocoa powder, corn starch, salt, large egg whites, milk chocolate chips, mini marshmallows]"
Slutty-Brownie-Cookies-1354912,Slutty Brownie Cookies,4,1860.0,"[Afternoon Tea, Desserts]",,"[all-purpose flour, cocoa powder, baking soda, corn starch, salt, unsalted butter, sugar, eggs, vanilla, chocolate extract, strong black coffee, chocolate, mini chocolate chips, chocolate chip cookies, OREO® Cookies]"
Snowmen-Cookies-1367687,Snowmen Cookies,4,2700.0,[Desserts],,"[vanilla, Nutter Butter Cookies, confetti sprinkles, chocolate, sunflower seeds, cake, icing]"
Coconut-Cream-Filled-Biscoff-Cookies-1377210,Coconut Cream Filled Biscoff Cookies,4,600.0,[Desserts],,"[salted butter, vanilla extract, powdered sugar, sweetened coconut flakes, Biscoff Cookies]"
Chocolate-Vanilla-Cookies-1373831,Chocolate Vanilla Cookies,4,2400.0,[Desserts],,"[flour, baking powder, sugar, butter, egg whites, water, vanilla, white chocolate chips, pink food coloring]"
Thick-Nutella-Chip-Shortbread-Cookies-1375404,Thick Nutella Chip Shortbread Cookies,4,3240.0,[Desserts],,"[chips, Nutella, butter, dark chocolate, dough, flour, powdered sugar, salt, vanilla]"
Fall-Foliage-Sugar-Cookies-1375499,Fall Foliage Sugar Cookies,4,3900.0,[Desserts],,"[unsalted butter, confectioners sugar, large eggs, vanilla extract, all-purpose flour, salt, red food colouring gel, food gel, cookies, orange colored sugar]"
Fat-Molasses-Cookies-1377614,Fat Molasses Cookies,3,3000.0,[Desserts],,"[all-purpose flour, baking soda, ground ginger, ground cinnamon, salt, shortening, brown sugar, molasses, eggs, water, cider vinegar, crystallized ginger, coarse sugar]"
Brown-Sugar-Cookies-1371214,Brown Sugar Cookies,4,1500.0,[Desserts],,"[all-purpose flour, baking soda, unsalted butter, butter flavor shortening, brown sugar, eggs, vanilla]"
Oreo-Stuffed-Chocolate-Chip-Cookies-1114282,Oreo Stuffed Chocolate Chip Cookies,5,1800.0,[Desserts],[Kid-Friendly],"[softened butter, light brown sugar, granulated sugar, large eggs, pure vanilla, all-purpose flour, kosher salt, baking soda, chocolate chips, OREO® Cookies]"
Strawberry-Shortcake-Cookies-1366412,Strawberry Shortcake Cookies,4,3300.0,"[Desserts, Afternoon Tea]",,"[strawberries, fresh lemon juice, sugar, lemon zest, all-purpose flour, baking powder, kosher salt, unsalted butter, heavy cream, coarse sugar]"
Butterfinger-Cookies-1379885,Butterfinger Cookies,4,1500.0,[Desserts],,"[flour, baking soda, salt, sugar, unsalted butter, eggs, butterfinger]"
Maple-Shortbread-Cookies-_-Maple-Cookbook-Review-1363209,Maple Shortbread Cookies & Maple Cookbook Review,4,1200.0,[Desserts],,"[unsalted butter, maple sugar, egg yolks, all-purpose flour, baking powder, salt, turbinado]"
Soft-Cream-Cheese-Sugar-Cookies-with-Perfect-Frosting-1378155,Soft Cream Cheese Sugar Cookies with Perfect Frosting,4,9900.0,[Desserts],,"[unsalted butter, granulated sugar, large eggs, reduced fat cream cheese, vanilla extract, almond extract, lemon zest, all-purpose flour, baking powder, kosher salt, powdered sugar, milk, light corn syrup, food colouring, sprinkles, decorating sugars, cookies]"
Soft-_-Chewy-Snickerdoodle-Cookies-1370669,Soft & Chewy Snickerdoodle Cookies,4,2340.0,[Desserts],,"[butter, granulated sugar, brown sugar, large eggs, vanilla, all-purpose flour, salt, baking soda, lemon juice, cinnamon]"
Red-Velvet-Cookies-1368306,Red Velvet Cookies,4,1500.0,[Desserts],,"[cookies, eggs, vegetable oil, powdered sugar]"
Fudge-Dipped-Orange-Shortbread-Cookies-1367708,Fudge Dipped Orange Shortbread Cookies,4,2400.0,[Desserts],,"[unsalted butter, shortening, sugar, eggs, vanilla extract, flour, baking powder, baking soda, grated orange peel, chocolate chips]"
Chocolate_-Hazelnut_-and-Caramel-Thumbprint-Cookies-1377613,"Chocolate, Hazelnut, and Caramel Thumbprint Cookies",3,3000.0,[Desserts],,"[all-purpose flour, Dutch-processed cocoa powder, butter, sugar, salt, egg yolks, milk, vanilla, chopped hazelnuts, egg whites, caramels, whipping cream, semisweet chocolate, shortening, hazelnuts]"
Christmas-Sugar-Cookies-1367280,Christmas Sugar Cookies,4,3300.0,[Desserts],,"[butter, white sugar, eggs, vanilla extract, all-purpose flour, baking powder, salt]"
Peppermint-Sugar-Cookies-1373603,Peppermint Sugar Cookies,3,2400.0,[Desserts],,"[all-purpose flour, baking powder, salt, butter, sugar, eggs, egg yolks, peppermint extract, food colouring, decorating sugars]"
Frosted-Sugar-Cookie-1350034,Frosted Sugar Cookie,4,2400.0,[Desserts],,"[sugar cookies, white sugar, butter, egg yolks, almond extract, all-purpose flour, baking soda, cream of tartar, frosting, confectioners sugar, milk]"
Christmas-Ornament-Gingerbread-Cookies-1366745,Christmas Ornament Gingerbread Cookies,3,7200.0,[Desserts],,"[cookie mix, butter, water, large eggs, icing]"
Bet-You-Can_t-Eat-Just-One-Sugar-Cookies-1373606,Bet You Can't Eat Just One Sugar Cookies,3,2400.0,[Desserts],,"[butter, cooking oil, granulated sugar, powdered sugar, baking soda, cream of tartar, salt, eggs, vanilla, all-purpose flour, decorating sugars, edible glitter]"
Strawberry-Swirl-Cookies-1371998,Strawberry Swirl Cookies,4,4500.0,[Desserts],,"[butter, sugar, brown sugar, large eggs, vanilla, flour, baking powder, salt, strawberry jam, coconut, chop fine pecan]"
Bakery-style-cookies-and-cream-cookies-334955,Bakery Style Cookies and Cream Cookies,5,2400.0,[Desserts],[Kid-Friendly],"[softened butter, granulated sugar, light brown sugar, large eggs, pure vanilla extract, all-purpose flour, baking soda, kosher salt, chocolate chips, cocoa powder, OREO® Cookies]"
Crunchy-Sugar-Cookies-1370462,Crunchy Sugar Cookies,4,2100.0,[Desserts],,"[all-purpose flour, baking powder, baking soda, shortening, granulated sugar, large eggs, pure vanilla extract]"
Chocolate-Crinkle-Cookies-1372317,Chocolate Crinkle Cookies,4,2400.0,"[Desserts, Afternoon Tea]",,"[unsalted butter, light brown sugar, large eggs, all-purpose flour, unsweetened cocoa powder, baking powder, salt, confectioners sugar]"
Potato-Chip-Cookies-1372730,Potato Chip Cookies,4,1800.0,[Desserts],,"[butter, sugar, vanilla extract, all-purpose flour, potato chips, powdered sugar]"
Thumbprint-Cookies-1368090,Thumbprint Cookies,4,2700.0,[Desserts],,"[butter, granulated sugar, blueberry pie filling, all-purpose flour, powdered sugar, milk]"
Christmas-Cookies_-Simple-Coconut-Macaroon-Recipe-_Gluten-Free_-1376210,Christmas Cookies! Simple Coconut Macaroon Recipe (Gluten-Free),4,1500.0,[Desserts],,"[sweetened coconut flakes, large egg whites, sugar, vanilla extract, salt]"
Copycat-Jenny-Bakery-Butter-Cookies-1380767,Copycat Jenny Bakery Butter Cookies,4,2100.0,[Desserts],,"[plain flour, corn starch, butter, powdered sugar]"
Monster-Soft-Pudding-Cookies-1353983,Monster Soft Pudding Cookies,3,1920.0,[Desserts],,"[unsalted butter, brown sugar, granulated sugar, large eggs, pure vanilla extract, all-purpose flour, baking soda, vanilla instant pudding, salt, chocolate]"
Snickerdoodles-Cookie-1377567,Snickerdoodles Cookie,4,2280.0,[Desserts],,"[all-purpose flour, cream of tartar, baking soda, salt, ground cinnamon, granulated sugar, butter, large eggs]"
Copycat-Jenny-Bakery-Butter-Cookies-1380446,Copycat Jenny Bakery Butter Cookies,4,2100.0,[Desserts],,"[plain flour, corn starch, butter, powdered sugar]"
Coconut-Cutout-Cookies-1379229,Coconut Cutout Cookies,4,2100.0,[Desserts],,"[coconut flour, baking soda, sea salt, butter, coconut oil, Truvía® natural sweetener, eggs, vanilla extract]"
Copycat-Jenny-Bakery-Butter-Cookies-1379790,Copycat Jenny Bakery Butter Cookies,4,2100.0,[Desserts],,"[plain flour, corn starch, butter, powdered sugar]"
Black-Forest-Cookies-1379309,Black Forest Cookies,4,4800.0,[Desserts],,"[unsalted butter, granulated sugar, large eggs, sour cream, pure vanilla extract, almond extract, all-purpose flour, unsweetened cocoa powder, baking powder, baking soda, kosher salt, morello cherries, semisweet chocolate, sweetened condensed milk, instant coffee, vanilla extract]"
Turtle-Cookies-1358284,Turtle Cookies,4,3900.0,[Desserts],,"[flour, cocoa powder, salt, butter, sugar, eggs, egg whites, milk, vanilla, pecans, candy, heavy cream]"
3-Ingredient-Cookie-Butter-Cookies-1351660,3-Ingredient Cookie Butter Cookies,4,900.0,[Desserts],,"[cookie butter, eggs, all-purpose flour]"
Pumpkin-Cookie-Pie-1375327,Pumpkin Cookie Pie,4,900.0,[Desserts],,"[Krusteaz Pie Crust Mix, water, cookie mix, unsalted butter, eggs, white chocolate chips, chopped pecans]"
Soft-Cookies-and-Cream-Cookies-963868,Soft Cookies and Cream Cookies,4,2400.0,[Desserts],,"[all-purpose flour, baking soda, butter, light brown sugar, granulated white sugar, cookies, large eggs, vanilla extract, OREO® Cookies]"
Snowball-Cookies-1323755,Snowball Cookies,4,1800.0,[Desserts],,"[butter, confectioners sugar, vanilla, all-purpose flour, salt, chopped nuts]"
Tropical-Thumbprint-Cookies-1379273,Tropical Thumbprint Cookies,4,1500.0,[Desserts],,"[unsalted butter, light brown sugar, egg yolks, zest, pure vanilla extract, all-purpose flour, kosher salt, egg whites, macadamia nuts, pineapple topping, marshmallows, lime zest]"
Melt-in-Your-Mouth-Pumpkin-Cookies-1363054,Melt-in-Your-Mouth Pumpkin Cookies,4,3300.0,[Desserts],,"[butter, granulated sugar, baking powder, baking soda, salt, ground cinnamon, ground nutmeg, eggs, vanilla, pumpkin, all-purpose flour, brown sugar, milk, powdered sugar]"
Butter-Thumbprint-Cookies-1376123,Butter Thumbprint Cookies,4,1500.0,[Desserts],,"[salted butter, confectioners sugar, vanilla extract, butter flavorings, kosher salt, all-purpose flour, jam]"
Monas-Cream-Cheese-Cookies-1370867,Mona’s Cream Cheese Cookies,4,2100.0,[Desserts],,"[cream cheese, butter, sugar, all purpose unbleached flour, vanilla extract, chopped pecans]"
Apple-Pie-Cookies-1278649,Apple Pie Cookies,4,6300.0,[Desserts],,"[apples, lemon juice, white sugar, brown sugar, corn starch, cinnamon, nutmeg, water, unsalted butter, all-purpose flour, salt, sugar, ice water, refrigerated piecrusts, apple pie filling, caramel sauce, eggs]"
Peppermint-Shortbread-Cookies-1377519,Peppermint Shortbread Cookies,4,1800.0,[Desserts],,"[all-purpose flour, sugar, butter, peppermint, extract, red food coloring]"
Iced-Oatmeal-Cookies-1358731,Iced Oatmeal Cookies,3,1620.0,[Desserts],,"[rolled oats, all-purpose flour, baking powder, baking soda, salt, cinnamon, ground nutmeg, butter, light brown sugar, sugar, large eggs, vanilla extract, confectioners sugar, milk]"
Swedish-Icebox-Cookies-1378028,Swedish Icebox Cookies,4,2400.0,[Desserts],[Swedish],"[butter, powdered sugar, eggs, plain flour, caraway seeds, walnuts, vanilla extract]"
Swedish-Sugar-Cookies-1376173,Swedish Sugar Cookies,3,2400.0,[Desserts],[Swedish],"[sugar, butter, large eggs, vanilla, cream of tartar, baking soda, flour]"
Walnut-Oatmeal-Cookies-1363802,Walnut Oatmeal Cookies,4,2100.0,[Desserts],,"[all-purpose flour, unsalted butter, brown sugar, white sugar, large eggs, oatmeal, chopped walnuts, vanilla extract, baking soda, salt]"
Ned-Ludds-Skillet-Cookie-1377973,Ned Ludd’s Skillet Cookie,3,3300.0,[Desserts],,"[all-purpose flour, baking soda, unsalted butter, white sugar, dark brown sugar, large eggs, salt, vanilla extract, chocolate wafer]"
Date-Night-Cookies-1376796,Date Night Cookies,4,1500.0,[Desserts],,"[almond flour, eggs, honey, coconut oil, coconut sugar, vanilla, baking soda, sea salt, dates, chopped pecans]"
Black-Gold-Cookies-1345899,Black Gold Cookies,4,3900.0,[Desserts],,"[all-purpose flour, baking powder, salt, semisweet chocolate, unsweetened chocolate, unsalted butter, large eggs, granulated sugar, vanilla]"
Tahini-Cookies-1378015,Tahini Cookies,4,2700.0,[Desserts],,"[caster sugar, unsalted butter, tahini paste, vanilla essence, cream, plain flour, ground cinnamon]"
Chocolat-Chip-Oatmeal-Cookies-1369596,Chocolat Chip Oatmeal Cookies,4,1800.0,[Desserts],,"[butter, brown sugar, granulated sugar, large eggs, vanilla extract, baking soda, baking powder, salt, all-purpose flour, old-fashioned oats, chocolate chips]"
FROZEN-inspired-Shortbread-Cookies-with-Gay-Lea-_-Contest-1368698,FROZEN inspired Shortbread Cookies with Gay Lea + Contest,4,2100.0,[Desserts],,"[butter, powdered sugar, peppermint extract, all-purpose flour, salt, candy canes]"
Almond-Butter-Banana-Cookies-1380660,Almond Butter Banana Cookies,4,1140.0,[Desserts],,"[mashed banana, almond butter, quick oats, vanilla extract, salt]"
Jumbo-Chocolate-Chip-Cookies-1374219,Jumbo Chocolate Chip Cookies,4,2400.0,[Desserts],,"[flour, corn starch, baking soda, salt, butter, brown sugar, granulated sugar, eggs, vanilla, chocolate chips]"
Chai-Latte-Snickerdoodle-Cookie-1375114,Chai Latte Snickerdoodle Cookie,4,4800.0,[Desserts],,"[cookies, sugar, chai tea, ground cinnamon, ground ginger, ground allspice, butter, eggs, vanilla, flour, cream of tartar, baking soda, salt, chocolate, chocolate wafer, icing, egg whites, powdered sugar, red food colouring gel]"
Snowball-cookies-369425,Snowball Cookies,5,2100.0,[Desserts],,"[unsalted butter, confectioners sugar, pure vanilla extract, all-purpose flour, chopped pecans, kosher salt, cookies]"
Italian-Anisette-Cookies-1371208,Italian Anisette Cookies,4,2400.0,[Desserts],,"[butter, shortening, granulated sugar, eggs, all-purpose flour, baking powder, salt, anise extract, confectioners sugar, milk]"
Soft-_-Chewy-M_M-Cookies-1354742,Soft & Chewy M&M Cookies,4,1500.0,[Desserts],,"[unsalted butter, brown sugar, granulated sugar, vanilla, large eggs, powdered vanilla pudding mix, all-purpose flour, baking soda, salt, cookies]"
Meltaway-Lemon-Cookies-1364684,Meltaway Lemon Cookies,3,1680.0,[Desserts],,"[all-purpose flour, baking powder, salt, unsalted butter, Dixie Crystals Extra Fine Granulated Sugar, large eggs, lemon, Dixie Crystals Confectioners Powdered Sugar, lemon juice]"
Christmas-Cookies-Funfetti-Cookies-1371911,Christmas Cookies – Funfetti Cookies,4,2100.0,[Desserts],,"[white cake mix, oil, eggs, sprinkles, mini m&ms]"
Salted-Caramel-Molasses-Cookies-1373630,Salted Caramel Molasses Cookies,4,3000.0,[Desserts],,"[unsalted butter, brown sugar, molasses, eggs, vanilla extract, baking soda, salt, cinnamon, ground ginger, ground cloves, ground nutmeg, flour, chocolate candy]"
Buttery-Ginger-Shortbread-Cookies-1353744,Buttery Ginger Shortbread Cookies,3,3300.0,[Desserts],,"[unsalted butter, superfine sugar, vanilla bean paste, candied ginger, fine sea salt, all purpose unbleached flour, granulated sugar]"
Pumpkin-Spice-Hot-Cocoa-Cookies-1376477,Pumpkin Spice Hot Cocoa Cookies,3,1200.0,[Desserts],,"[cookie mix, eggs, unsalted butter, milk, milk chocolate, large marshmallows, ground cinnamon]"
Cookies-and-Cream-Cookies-1073458,Cookies and Cream Cookies,4,2400.0,[Desserts],,"[butter, sugar, brown sugar, eggs, vanilla, all-purpose flour, baking soda, salt, cookies, OREO® Cookies]"
Snickerdoodle-Cookies-1338918,Snickerdoodle Cookies,4,1800.0,[Desserts],,"[all-purpose flour, baking soda, cream of tartar, salt, ground cinnamon, butter, vegetable oil, powdered sugar, granulated sugar, vanilla extract, large eggs]"
Christmas-Sugar-Cookie-Cutouts_-1362707,Christmas Sugar Cookie Cutouts!,4,3000.0,[Desserts],,"[all-purpose flour, baking powder, salt, organic butter, organic sugar, eggs, vanilla]"
Chewy-Sugar-Cookies-1351980,Chewy Sugar Cookies,3,4200.0,"[Desserts, Afternoon Tea]",,"[all-purpose flour, baking powder, kosher salt, unsalted butter, sugar, large eggs, pure vanilla extract]"
Simple-Spiced-Linzer-Cookies-1370246,Simple Spiced Linzer Cookies,4,2820.0,[Desserts],,"[unsalted butter, sugar, vanilla extract, cardamom, all-purpose flour, kosher salt, powdered sugar, strawberry jam]"
Vanilla-Cookies-964625,Vanilla Cookies,4,2700.0,"[Desserts, Afternoon Tea]",,"[all-purpose flour, baking powder, salt, unsalted butter, sugar, eggs, vanilla extract]"
Grain-Free-Sugar-Cookie-Cut-Outs-1377603,Grain-Free Sugar Cookie Cut-Outs,4,3000.0,[Desserts],,"[cashew meal, coconut flour, baking soda, sea salt, coconut oil, raw honey, almond extract]"
Chocolate-Chip-Peanut-Butter-Cookies-1375731,Chocolate Chip Peanut Butter Cookies,4,2400.0,[Desserts],,"[wheat flour, baking powder, salt, large egg whites, vanilla extract, peanut butter, coconut sugar, dark chocolate chip, miniature chocolate chips]"
Eggnog-Thumbprint-Cookies-1374917,Eggnog Thumbprint Cookies,4,1320.0,[Desserts],,"[unsalted butter, granulated sugar, light brown sugar, eggs, vanilla, all-purpose flour, salt, powdered sugar, spiced rum, ground nutmeg]"
Pill-Bottle-Cookies-1363959,Pill Bottle Cookies,4,3600.0,[Desserts],,"[butter, heavy cream, flour, granulated sugar, powdered sugar, vanilla, yolk]"
Salted-Caramel-Apple-Cookies-1373699,Salted Caramel Apple Cookies,3,4200.0,[Desserts],,"[cookie mix, butter, eggs, Gold Medal All Purpose Flour, apple pie spice, apples, chopped pecans, caramels, heavy whipping cream, coarse sea salt]"
Shortbread-Cookies-1171306,Shortbread Cookies,4,1800.0,[Desserts],,"[butter, eggs, vanilla extract, sugar, all-purpose flour, chocolate chip cookies, M&M's Candy]"
Snickerdoodle-Cookies-1378835,Snickerdoodle Cookies,4,1800.0,[Desserts],,"[butter, sugar, large eggs, flour, cream of tartar, baking soda, salt, cinnamon]"
Pumpkin-Cookies-1341699,Pumpkin Cookies,4,1080.0,[Desserts],,"[flour, baking soda, baking powder, pumpkin pie spice, cinnamon, salt, butter, granulated sugar, pumpkin, eggs, vanilla, confectioners sugar]"
Pumpkin-Cookie-Butter-Dip-1378518,Pumpkin Cookie Butter Dip,4,1500.0,[Appetizers],,"[cream cheese, cookie butter, brown sugar, pumpkin purée, vanilla extract, cinnamon, nutmeg, allspice, salt]"
Slutty-Brownie-Cookies-1377386,Slutty Brownie Cookies,4,,,,"[all-purpose flour, cocoa powder, baking soda, corn starch, salt, unsalted butter, sugar, eggs, vanilla, chocolate extract, strong black coffee, chocolate, mini chocolate chips, chocolate chip cookies, OREO® Cookies]"
Candida-Killing-Cinnamon-Cookies-1375518,Candida Killing Cinnamon Cookies,4,960.0,[Desserts],,"[coconut oil, almonds, xylitol sweetener, large eggs, baking soda, baking powder, pink salt, pure vanilla extract, cinnamon, coconut flour]"
Peppermint-Fudge-Thumbprint-Cookies-1377563,Peppermint Fudge Thumbprint Cookies,4,2700.0,[Desserts],,"[butter, white sugar, egg yolks, flour, candy canes, mint extract, heavy whipping cream, semi-sweet chocolate morsels]"
Tea-Cup-Cookies-1375550,Tea Cup Cookies,4,1800.0,[Desserts],,"[biscuits, chocolate, marshmallows, peppermint, icing, sprinkles]"
Mint-Chocolate-Shamrock-Cookies-1380496,Mint Chocolate Shamrock Cookies,4,3600.0,[Desserts],,"[butter, brown sugar, water, semi-sweet chocolate morsels, eggs, flour, baking soda, salt]"
Grandma_s-Shortbread-Cookies-_Cookie-Press_-1354834,Grandma's Shortbread Cookies (Cookie Press),4,1500.0,[Desserts],,"[butter, vanilla, powdered sugar, corn starch, salt, all-purpose flour]"
Thumbprint-Snowman-Cookies-1371539,Thumbprint Snowman Cookies,4,3300.0,"[Afternoon Tea, Desserts]",,"[butter, granulated sugar, brown sugar, baking powder, salt, eggs, milk, vanilla, all-purpose flour, icing, powdered sugar, almond extract, food colouring]"
Muesli-Breakfast-Cookies-1365962,Muesli Breakfast Cookies,4,1500.0,[Breakfast and Brunch],,"[coconut oil, light brown sugar, eggs, muesli, sweetened coconut]"
Dutch-Apple-Pie-Cookies-1365489,Dutch Apple Pie Cookies,4,3000.0,"[Afternoon Tea, Desserts]",,"[pie dough, granny smith apples, granulated sugar, ground cinnamon, lemon juice, corn starch, all-purpose flour, brown sugar, old-fashioned oats, salt, butter]"
Honey-Sesame-Cookies-1366537,Honey Sesame Cookies,4,2700.0,[Desserts],,"[eggs, flour, butter, honey, sugar, vanilla extract, baking powder, sesame seeds]"
Italian-Wedding-Cookie-1366832,Italian Wedding Cookie,4,2700.0,[Desserts],,"[unsalted butter, powdered sugar, salt, ground almonds, vanilla extract, all-purpose flour]"
Easy-Iced-Oatmeal-Cardamom-Cookies-1376469,Easy Iced Oatmeal-Cardamom Cookies,3,2100.0,[Desserts],,"[Betty Crocker™ oatmeal cookie mix, butter, eggs, water, ground cardamom, butterscotch topping, milk, ground cinnamon, vanilla, powdered sugar]"
Almond-Joy-Cookies-1376362,Almond Joy Cookies,3,2100.0,[Desserts],,"[butter, granulated sugar, eggs, vanilla, flour, baking soda, salt, semi-sweet chocolate morsels, sweetened coconut flakes, slivered almonds]"
Chocolate-Peppermint-Cookies-1363031,Chocolate Peppermint Cookies,4,2400.0,"[Desserts, Afternoon Tea]",,"[all-purpose flour, unsweetened cocoa powder, baking soda, salt, unsalted butter, sugar, eggs, vanilla, M&M's Candy, semi-sweet chocolate morsels]"
Mascarpone-Oreo-Snowflake-Cookies-966393,Mascarpone Oreo Snowflake Cookies,4,2400.0,[Desserts],,"[butter, mascarpone, sugar, egg yolks, flour, vanilla, OREO® Cookies]"
Eggless-Custard-Cookies-1370113,Eggless Custard Cookies,4,2400.0,[Desserts],,"[unsalted butter, all-purpose flour, powdered sugar, custard powder, pure vanilla extract]"
Funfetti-Cake-Batter-Cookies-1362082,Funfetti Cake Batter Cookies,4,1800.0,[Desserts],,"[vanilla cake mix, baking powder, eggs, vegetable oil, vanilla extract, sprinkles]"
Chewy-Gingerbread-Cookies-1323745,Chewy Gingerbread Cookies,4,3300.0,[Desserts],,"[unsalted butter, brown sugar, large eggs, molasses, all-purpose flour, baking soda, kosher salt, ground ginger, ground cinnamon, ground cloves, ground nutmeg, ground allspice, granulated white sugar]"
Cranberry-Cookies-1358206,Cranberry Cookies,4,3600.0,[Desserts],,"[butter, sugar, brown sugar, eggs, milk, all-purpose flour, baking powder, salt, fresh cranberries, chopped walnuts]"
Almond-Raspberry-Shortbread-Thumbprint-Cookies-1362463,Almond Raspberry Shortbread Thumbprint Cookies,4,2100.0,[Desserts],,"[sugar, butter, almond extract, flour, seedless raspberry jam, powdered sugar, milk]"
Peanut-Butter-Chocolate-Chip-Cookies-1330643,Peanut Butter Chocolate Chip Cookies,4,1800.0,[Desserts],,"[sugar, peanut butter, eggs, vanilla, baking soda, salt, chocolate chip cookies]"
