id,recipeName,rating,totalTimeInSeconds,course,cuisine,ingredients
Lemon-Garlic-Pasta-1374235,Lemon Garlic Pasta,4,3300.0,[Main Dishes],,"[pasta shells, cashew nuts, lemon juice, garlic, almond milk, nutritional yeast, salt, pepper]"
One-Skillet-BLT-Pasta-1375613,One Skillet BLT Pasta,4,1800.0,[Main Dishes],,"[Pure Wesson Canola Oil, yellow onion, diced tomatoes, water, tomato sauce, rotini, garlic salt, cooked bacon, baby spinach leaves, grated parmesan cheese]"
Cheesy-Pasta-with-Bacon-and-Kale-1370389,Cheesy Pasta with Bacon and Kale,4,900.0,[Main Dishes],,"[pasta, vegetable oil, bacon, kale, cheese, cream]"
Garlic-Chicken-Pasta-1371534,Garlic Chicken Pasta,4,2100.0,[Main Dishes],,"[cooked chicken, garlic, olive oil, whole wheat pasta, whole milk, butter, sea salt, grated parmesan cheese]"
Jambalaya-Pasta-1374533,Jambalaya Pasta,4,2700.0,[Main Dishes],,"[olive oil, smoked sausage, boneless skinless chicken breasts, diced onions, bell pepper, creole seasoning, garlic, low sodium chicken broth, heavy cream, penne pasta, monterey jack, scallions]"
Pasta-Chips-1365268,Pasta Chips,3,2400.0,[Lunch and Snacks],,"[pasta, chili powder, black pepper, chaat masala, garlic powder, dried oregano, salt, oil]"
Mozzarella-Chicken-Pasta-1369040,Mozzarella Chicken Pasta,3,4500.0,[Main Dishes],,"[rigatoni, chicken breast tenders, olive oil, seasoning salt, pepper, garlic, baby spinach, unsalted butter, all-purpose flour, half & half, dried basil, crushed red pepper flakes, smoked mozzarella, part-skim mozzarella cheese, diced tomatoes, salt, parmesan cheese]"
Pizza-pasta-333870,Pizza Pasta,5,1200.0,[Main Dishes],,"[whole wheat pasta, tomato sauce, fresh mozzarella, italian seasoning, pepperoni, parmesan cheese, provolone cheese]"
Garlicky-Arugula-Pasta-1357509,Garlicky Arugula Pasta,3,1800.0,[Main Dishes],,"[salt, linguine, extra-virgin olive oil, garlic, red pepper flakes, fish sauce, baby arugula]"
Creamy-caprese-pasta-333554,Creamy Caprese Pasta,5,2400.0,,,"[whole wheat pasta, pasta sauce, heavy cream, grated parmesan cheese, fresh mozzarella, grape tomatoes, fresh basil leaves]"
Pasta-w_Poached-Egg_-Asparagus_-_-Lemon-_Wanna-Be-A-Country-Cleaver_-1377853,"Pasta w/Poached Egg, Asparagus, & Lemon {Wanna Be A Country Cleaver}",4,2400.0,[Main Dishes],,"[angel hair, asparagus, olive oil, grated parmesan cheese, low-fat ricotta, eggs, white vinegar, shrimp, lemon, salt, pepper]"
Fettuccine-Pasta-with-Peppers-1373295,Fettuccine Pasta with Peppers,4,1500.0,[Main Dishes],,"[fettuccine pasta, green bell pepper, red bell pepper, yellow bell pepper, extra-virgin olive oil, garlic, bertolli]"
One-Skillet-BLT-Pasta-1378825,One Skillet BLT Pasta,4,1800.0,[Main Dishes],,"[Pure Wesson Canola Oil, yellow onion, diced tomatoes, water, tomato sauce, rotini, garlic salt, cooked bacon, baby spinach leaves, grated parmesan cheese]"
Turkey-_or-Chicken_-Cordon-Bleu-Pasta-1373542,Turkey (or Chicken) Cordon Bleu Pasta,4,,,,"[pasta, flour, skim milk, dijon mustard, shredded cheddar cheese, turkey, frozen peas, diced ham, kosher salt, black pepper]"
Uncle-Vinny_s-Light-Lemon-Pasta-1364432,Uncle Vinny's Light Lemon Pasta,3,1800.0,[Main Dishes],,"[bow-tie pasta, butter, heavy cream, juice, lemon, chicken broth]"
Organic-School-Lunch-Pasta-1362718,Organic School Lunch Pasta,4,2100.0,"[Lunch and Snacks, Main Dishes]",,"[organic turkey, cheese, ham, broccoli, rigatoni, carrots, italian salad dressing, salt]"
Chilli-Prawn-Pasta-1360842,Chilli Prawn Pasta,3,1500.0,[Main Dishes],,"[chillies, garlic, pasta, spring onions, worcestershire sauce, fresh chives, prawns, passata]"
Balsamic-Mushroom-Pasta-1367233,Balsamic Mushroom Pasta,4,1500.0,[Main Dishes],,"[fettuccine pasta, butter, olive oil, shallots, garlic cloves, portabello mushroom, balsamic vinegar, cream, fresh parsley, grated parmesan cheese, pepper, salt]"
One-Pot-Shrimp-Parmesan-Pasta-1372140,One Pot Shrimp Parmesan Pasta,3,2100.0,[Main Dishes],,"[white onion, garlic, Barilla Pasta Sauce, chicken broth, pasta, spinach, cooked shrimp, parmesan cheese]"
Chicken-Fajita-Pasta-1057903,Chicken Fajita Pasta,4,1800.0,[Main Dishes],,"[olive oil, boneless skinless chicken breasts, fajita seasoning mix, diced onions, bell pepper, garlic, low sodium chicken broth, heavy cream, diced tomatoes, penne pasta, salt]"
Aromatic-Pasta-With-Chicken-1364435,Aromatic Pasta With Chicken,3,900.0,[Main Dishes],,"[pasta shells, marinara sauce, boneless skinless chicken breasts, butter, oil, salt, pepper]"
Roasted-Butternut-Squash-and-Spinach-Pasta-1373940,Roasted Butternut Squash and Spinach Pasta,4,2400.0,[Main Dishes],,"[butternut squash, fresh spinach, pinenuts, currant, chopped garlic, sesame oil, fresh thyme, Himalayan salt, pasta]"
Pasta-Halloween-1373481,Pasta Halloween,4,2400.0,[Main Dishes],,"[tagliatelle, salt, black pepper, olive oil, butter, mozzarella balls, pitted black olives]"
Pasta-Pomodoro-with-Lentils-1361934,Pasta Pomodoro with Lentils,4,2700.0,[Main Dishes],,"[water, dried lentils, Bertolli Tomato & Basil Sauce, penn pasta, cook and drain, part-skim mozzarella cheese]"
Not-So-Homemade-Chicken-Alfredo-_-Mushroom-Pasta-1378400,Not So Homemade Chicken Alfredo & Mushroom Pasta,4,2100.0,[Main Dishes],,"[olive oil, boneless chicken, salt, freshly ground black pepper, butter, mushrooms, Alfredo sauce, angel hair, parsley]"
Jambalaya-Pasta-1090751,Jambalaya Pasta,4,2400.0,[Main Dishes],,"[sauce, olive oil, boneless skinless chicken breasts, kielbasa, bow-tie pasta, parsley]"
Creamy-Cajun-Chicken-Pasta-Recipes-1376830,Creamy Cajun Chicken Pasta Recipes,4,1800.0,[Main Dishes],[Cajun & Creole],"[boneless skinless chicken breast halves, linguine, cajun seasoning, butter, green onions, heavy whipping cream, sun-dried tomatoes, salt, dried basil, ground black pepper, garlic powder, grated parmesan cheese]"
Pasta-with-Butternut-Squash-and-Kale-Pesto-1378102,Pasta with Butternut Squash and Kale Pesto,4,1800.0,[Main Dishes],,"[butternut squash, extra-virgin olive oil, salt, freshly ground black pepper, whole wheat pasta, pesto, toasted pine nuts, grated parmesan cheese]"
Perfect-Pasta-Salad-Toss-1379492,Perfect Pasta Salad Toss,4,2400.0,[Salads],,"[penn pasta, cook and drain, sliced salami, roast red peppers, drain, artichoke hearts, pitted kalamata olives, fresh basil leaves, caesar salad dressing, Sargento® Artisan Blends® Shredded Parmesan Cheese, romaine lettuce leaves]"
Chicken-Fajita-Pasta-1369131,Chicken Fajita Pasta,4,1800.0,[Main Dishes],,"[pasta, oil, skinless chicken breasts, taco seasoning, onions, green bell pepper, slice, red bell pepper, yellow bell pepper, garlic, chicken broth, diced tomatoes, sour cream, cilantro]"
Creamy-Pumpkin-Pasta-1357733,Creamy Pumpkin Pasta,4,2100.0,[Main Dishes],,"[linguine, butter, flour, garlic cloves, milk, shredded parmesan cheese, pumpkin purée, nutmeg, salt, ground black pepper, parsley]"
Lemony-Pasta-with-Garlic-and-Capers-1352797,Lemony Pasta with Garlic and Capers,4,1500.0,[Main Dishes],,"[pasta, olive oil, garlic, lemon zest, lemon juice, grated parmesan cheese, capers, kosher salt, black pepper]"
Avocado-Pasta-Salad-1357126,Avocado Pasta Salad,4,3000.0,[Salads],,"[rotini, cherry tomatoes, bacon, green onions, chopped cilantro, avocado, lime juice, fresh lime, cumin, garlic powder, buttermilk, pepper, salt]"
Spinach-and-Artichoke-Pasta-1350224,Spinach and Artichoke Pasta,4,1800.0,[Main Dishes],,"[unsalted butter, fresh spinach, cream cheese, sour cream, shredded parmesan cheese, artichoke hearts, jalapeno chilies, garlic cloves, cooking liquid, penne pasta]"
Baked-Chicken-_-Spinach-Pasta-1351717,Baked Chicken & Spinach Pasta,4,3900.0,[Main Dishes],,"[pasta, boneless skinless chicken breasts, olive oil, garlic, salt, fresh spinach, white wine, mozzarella cheese]"
Angel-Hair-Pasta-With-Light-Garlic-Sauce-1363617,Angel Hair Pasta With Light Garlic Sauce,3,1200.0,[Main Dishes],,"[angel hair, olive oil, fresh parsley, garlic, grated parmesan cheese, ground pepper]"
Easy-Italian-Pasta-Bake-1358675,Easy Italian Pasta Bake,4,3000.0,[Main Dishes],[Italian],"[ground beef, chopped onion, tomato sauce, water, basil, oregano, garlic powder, sea salt, whole wheat pasta, shredded cheese]"
Fresh-Vegetarian-Greek-Pasta-1062342,Fresh Vegetarian Greek Pasta,4,1800.0,[Main Dishes],[Greek],"[tomatoes, kalamata, feta cheese, chopped parsley, basil, salt, black pepper, penne pasta, olive oil, garlic]"
Fresh-Tomato-and-Ricotta-Whole-Wheat-Pasta-1376535,Fresh Tomato and Ricotta Whole Wheat Pasta,4,1500.0,[Main Dishes],[Italian],"[bow-tie pasta, extra-virgin olive oil, garlic, tomatoes, freshly ground black pepper, kosher salt, fresh spinach leaves, fresh basil, grated parmesan cheese, ricotta cheese]"
Chicken-Bow-tie-Pasta-1362585,Chicken Bow-tie Pasta,4,2400.0,[Main Dishes],,"[chicken breasts, cream of chicken soup, cream of mushroom soup, oregano, basil, salt, pepper, bow-tie pasta, baby spinach, olive oil]"
One-Pot-Cheesy-Italian-Chicken-and-Pasta-1362917,One Pot Cheesy Italian Chicken and Pasta,4,1800.0,[Main Dishes],[Italian],"[olive oil, chicken, crushed red pepper flakes, onions, garlic, crushed tomatoes, diced tomatoes, italian seasoning, kosher salt, cracked black pepper, chicken stock, bow-tie pasta, shredded mozzarella cheese, leaf parsley, grated parmesan cheese]"
Penne-Pasta-With-Sausage-1354023,Penne Pasta With Sausage,4,2400.0,[Main Dishes],,"[penne pasta, cherry tomatoes, baby spinach, extra-virgin olive oil, garlic, parmesan cheese]"
Asparagus-and-Chicken-Pasta-1072825,Asparagus and Chicken Pasta,3,1800.0,[Main Dishes],,"[pasta, asparagus, chicken breasts, olive oil, basil, parmesan cheese, white wine]"
Mushroom-Pasta-Martha-Stewart-197322,Mushroom Pasta,5,2400.0,[Main Dishes],,"[mushrooms, pasta, white wine, heavy cream, parmesan cheese]"
Crab-pasta-334599,Crab Pasta,5,1500.0,[Main Dishes],,"[angel hair, olive oil, garlic, basil leaves, cherry tomatoes, lemon, Dungeness crabs, salt]"
Bacon-Wrapped-Shrimp-Pasta-1357646,Bacon-Wrapped Shrimp Pasta,4,1200.0,[Main Dishes],,"[jumbo shrimp, bacon slices, olive oil, ragu, tomato sauce, pasta, parmesan cheese]"
Crispy-Shrimp-Pasta-1296198,Crispy Shrimp Pasta,4,1800.0,[Main Dishes],,"[fettuccine pasta, shrimp, salt, ground black pepper, flour, olive oil, butter, low sodium chicken broth, whipping cream, cajun seasoning]"
Sausage-Pasta-1313939,Sausage Pasta,4,2100.0,[Main Dishes],,"[pasta, olive oil, grape tomatoes, purple onion, parmesan cheese, red bell pepper, oregano, salt, pepper, sausage links]"
Spicy-Orange-Pasta-1356501,Spicy Orange Pasta,4,1500.0,[Main Dishes],,"[purple onion, minced garlic, crushed red pepper flakes, paprika, olive oil, chicken broth, crushed tomatoes, basil, oregano, heavy cream, noodles, meatballs]"
Skillet-Baked-Pasta-1378624,Skillet Baked Pasta,3,2100.0,[Main Dishes],,"[bows, hot Italian sausages, marinara sauce, shredded mozzarella cheese, Italian seasoned breadcrumbs, grated parmesan cheese]"
One-Pan-Brown-Butter-and-Sage-Pasta-1359955,One-Pan Brown Butter and Sage Pasta,4,1500.0,[Main Dishes],,"[pasta, butter, olive oil, fresh sage, salt, red pepper flakes, fresh lemon, white button mushrooms, fresh spinach, garlic, grating cheese]"
Pasta-caprese-299294,Pasta Caprese,4,1200.0,[Main Dishes],[Italian],"[penn pasta, cook and drain, cherry tomatoes, Wish-Bone® Robusto Italian Dressing, chees fresh mozzarella, arugula]"
Garden-Pasta-1379192,Garden Pasta,3,3000.0,[Main Dishes],,"[sliced carrots, broccoli florets, dried fettuccine, onions, garlic, butter, reduced fat milk, all-purpose flour, salt, ground black pepper, prosciutto, fresh basil]"
Penne-Pasta-1015033,Penne Pasta,4,1800.0,[Main Dishes],,"[water, salt, penne pasta, pasta sauce, sausage links, pecorino romano cheese]"
One-Pot-Tomato-and-Basil-Tortellini-Soup-1373784,One-Pot Tomato and Basil Tortellini Soup,4,2400.0,[Soups],,"[white onion, carrots, olive oil, fresh basil, non fat chicken stock, skim milk, half & half, ragu, diced tomatoes, salt, pepper, garlic powder, cheese tortellini, parmesan cheese, basil]"
Aglio-Olio-Parmesan-Pasta-1185693,Aglio Olio Parmesan Pasta,4,1500.0,,,"[angel hair, butter, olive oil, pepperoncino, grated parmesan cheese, salt]"
Italian-Sausage-Pasta-1369702,Italian Sausage Pasta,4,2700.0,[Main Dishes],[Italian],"[olive oil, sweet Italian turkey sausage, onions, garlic cloves, white wine, tomatoes, rigatoni, arugula, grated parmesan cheese]"
Garlic-Pasta-with-Asparagus-1357503,Garlic Pasta with Asparagus,4,900.0,[Main Dishes],,"[angel hair, olive oil, minced garlic, red pepper flakes, salt, black pepper, fresh parsley, fresh parmesan cheese]"
Turkey-Sausage-and-Pasta-1377015,Turkey Sausage and Pasta,4,2100.0,[Main Dishes],,"[sausage casings, vegetable oil, onions, butter, roasted red peppers, mushrooms, pasta, bbq sauce]"
Tomato_-Pepper-and-Rocket-Penne-Pasta-1360883,"Tomato, Pepper and Rocket Penne Pasta",4,1500.0,[Main Dishes],,"[whole wheat penne pasta, cherry tomatoes, pepper, rocket leaves, parmesan cheese]"
Bacon-Alfredo-Pasta-Bake-1363884,Bacon Alfredo Pasta Bake,4,3000.0,[Main Dishes],,"[pasta, Ragu Alfredo Sauce, sour cream, bacon, ricotta cheese, garlic, eggs, parmesan cheese, parsley, salt, pepper, mozzarella cheese, panko breadcrumbs]"
Creamy-Dreamy-Zucchini-Pasta-1353613,Creamy Dreamy Zucchini Pasta,4,1200.0,,,"[zucchini, roma tomatoes, avocado, fresh parsley, garlic, lime juice, extra-virgin olive oil, dried basil, chopped walnuts, water]"
Cheesy-Broccoli-Pasta-Bake-1368983,Cheesy Broccoli Pasta Bake,4,3000.0,[Main Dishes],,"[short pasta, broccoli florets, tomato purée, water, basil, oregano, salt, garlic, fontina cheese, parmesan cheese]"
Pesto-Ricotta-Stuffed-Pasta-Shells-1380228,Pesto Ricotta Stuffed Pasta Shells,4,4800.0,[Main Dishes],[Italian],"[jumbo shells, mild Italian sausage, Ragu Sauce, ricotta cheese, large eggs, pesto, mozzarella cheese, pinenuts, panko breadcrumbs, avocado]"
Quick-_-Easy-Chicken-Pasta-1370755,Quick & Easy Chicken Pasta,4,1800.0,[Main Dishes],,"[pasta, pesto, garlic, garlic cloves, turkey bacon, spinach, sun-dried tomatoes, low fat alfredo sauce, salt, ground pepper, basil]"
Pasta-with-Peas-and-Sausage-1369462,Pasta with Peas and Sausage,4,900.0,[Main Dishes],,"[rotini, breakfast sausages, frozen peas, grating cheese]"
Tuna-Penne-Pasta-1354632,Tuna Penne Pasta,4,1200.0,[Main Dishes],,"[pasta, tuna, white onion, green peas, cooking oil, cheese, salt]"
30-Minute-Baked-Bacon-Macaroni-and-Cheese-Cups-1375437,30 Minute Baked Bacon Macaroni and Cheese Cups,4,2700.0,,,"[elbow macaroni, seasoned bread crumbs, bacon bits, butter, salt, pepper, large eggs, Mexican cheese blend, milk]"
Grilled-Chicken-Buffalo-Pasta-929729,Grilled Chicken Buffalo Pasta,4,1500.0,[Main Dishes],,"[boneless chicken breast, penne pasta, buffalo sauce, blue cheese dressing, parsley]"
Taco-Pasta-1027604,Taco Pasta,4,2400.0,[Main Dishes],,"[ground beef, pasta shapes, onions, garlic, salsa, taco seasoning, cream cheese, sour cream, salt, pepper, shredded cheese]"
Caramelized-Garlic-Pasta-1003203,Caramelized Garlic Pasta,3,1800.0,[Main Dishes],,"[olive oil, garlic, pasta, parmesan cheese, salt, pepper]"
Leftover-Turkey-Soup-1375163,Leftover Turkey Soup,4,2850.0,[Soups],,"[chicken broth, water, sliced carrots, chopped celery, chopped onion, noodles, cooked turkey, fresh thyme, kosher salt, pepper, garlic powder]"
Rasta-Pasta-1022612,Rasta Pasta,4,3600.0,[Main Dishes],,"[chicken breasts, penne pasta, olive oil, green onions, garlic cloves, jerk seasoning, knorr parma rosa sauc mix, grating cheese, bell pepper, milk]"
One-Pot-Cajun-Chicken-and-Sausage-Alfredo-Pasta-1362762,One Pot Cajun Chicken and Sausage Alfredo Pasta,4,1200.0,[Main Dishes],,"[extra-virgin olive oil, chicken, kosher salt, freshly ground black pepper, smoked sausage, garlic, low sodium chicken broth, heavy cream, penne pasta, cajun seasoning, shredded parmesan cheese, flat leaf parsley]"
Buttery-Tomato-Pasta-Simply-Recipes-287090,Buttery Tomato Pasta,5,1500.0,,,"[fusilli, tomatoes, butter, sugar, salt, pepper, dried basil]"
Crispy-Shrimp-Pasta-633652,Crispy Shrimp Pasta,3,2100.0,[Main Dishes],,"[fettuccine pasta, shrimp, kosher salt, freshly ground pepper, flour, olive oil, butter, low sodium chicken broth, whipping cream, cajun seasoning]"
One-Pot-Chicken-and-Pasta-1353537,One Pot Chicken and Pasta,3,1800.0,[Main Dishes],,"[olive oil, boneless skinless chicken breasts, salt, pepper, purple onion, green bell pepper, garlic, dried basil, dried oregano, red pepper flakes, fire roasted diced tomatoes, reduced sodium chicken broth, fusilli, grated parmesan cheese]"
Vietnamese-Chicken-Noodle-Soup-Pho-Ga-1354531,Vietnamese Chicken Noodle Soup – Phở Gà,4,5400.0,[Soups],,"[chicken, cinnamon sticks, star anise, brown cardamom, onions, shallots, ginger, noodles, cilantro, spring onions, salt, sugar, fish sauce]"
Simple-Tomato-and-Mushroom-Pasta-1366463,Simple Tomato and Mushroom Pasta,4,780.0,[Main Dishes],,"[pasta, cherry tomatoes, chestnut mushrooms, spinach, garlic, tomato purée, miso paste, chili flakes, paprika, salt, pepper, lemon]"
Creamy-Gruyere-and-Shrimp-Pasta-1372342,Creamy Gruyère and Shrimp Pasta,4,3000.0,[Main Dishes],,"[cavatelli, all-purpose flour, salt, 2% reduced-fat milk, gruyere cheese, butter, large shrimp, garlic cloves, dry white wine, ground red pepper, frozen peas, cooking spray, parsley sprigs]"
Breakfast-Pasta-Bake-1372035,Breakfast Pasta Bake,4,3300.0,[Breakfast and Brunch],,"[dry pasta, veggies, chicken sausage, paprika, black pepper, colby jack cheese, eggs, milk]"
Pasta-with-asparagus-351945,Pasta with Asparagus,5,1800.0,[Main Dishes],,"[asparagus, pasta, extra-virgin olive oil, garlic, salt, cracked black pepper, large egg yolks, parmigiano reggiano cheese]"
Pinky-Pasta-Martha-Stewart-196572,Pinky Pasta,4,1800.0,[Main Dishes],,"[pasta, garlic cloves, tomato paste, chicken stock, ground black pepper, butter]"
Pork-Chops-Florentine-1371220,Pork Chops Florentine,3,1800.0,[Main Dishes],,"[olive oil, boneless chop pork, onions, marinara sauce, spinach, mozzarella cheese, whole grain pasta]"
Under-30-MINUTES-One-Pot-Pasta-1377016,Under 30 MINUTES One-Pot Pasta,3,1200.0,[Main Dishes],,"[fettuccine pasta, cherry tomatoes, chives, garlic, red pepper flakes, bell pepper, basil, rosemary, olive oil, salt, freshly ground pepper, water, grated parmesan cheese]"
Creamy-Pasta-with-Ham-and-Peas-1379348,Creamy Pasta with Ham and Peas,3,600.0,[Main Dishes],,"[pasta, peas, cream, ham, parmesan cheese, olive oil, pepper, salt]"
Lemon-Basil-Pasta-575728,Lemon-Basil Pasta,3,1500.0,[Main Dishes],,"[linguine, kidney, lemon, olive oil, fresh basil leaves]"
Bang-Bang-Chicken-Pasta-1047594,Bang Bang Chicken Pasta,4,3000.0,[Main Dishes],,"[pasta, boneless chicken breast, garlic, chopped parsley, mayonnaise, sweet chili sauce, honey, Sriracha, lime juice]"
Cold-Pasta-Salad-1350815,Cold Pasta Salad,4,2100.0,[Salads],,"[diced tomatoes, large garlic cloves, red pepper flakes, fresh basil, red wine vinegar, salt, rotini, cucumber, red pepper, yellow peppers, grape tomatoes, green onions, fresh parsley, pitted black olives, extra-virgin olive oil, feta cheese crumbles]"
Light-and-healthy-pasta-salad-335500,Light and Healthy Pasta Salad,5,1200.0,[Salads],,"[pasta, red bell pepper, zucchini, yellow squash, broccoli, poppy seed dressing]"
Stuffed-Pasta-Shells-with-Spinach-and-Broccoli-1361203,Stuffed Pasta Shells with Spinach and Broccoli,4,3000.0,[Main Dishes],,"[jumbo pasta shells, broccoli florets, spinach leaves, large eggs, part-skim ricotta cheese, cottage cheese, grated parmesan cheese, Italian cheese blend, garlic powder, onion powder, dried oregano, ground pepper, ragu]"
Spicy-Shrimp-Parmesan-Pasta-1369085,Spicy Shrimp Parmesan Pasta,4,1800.0,[Main Dishes],,"[olive oil, garlic cloves, light brown sugar, soy sauce, red pepper flakes, shrimp, pasta, parmesan cheese]"
Cilantro-pasta-297986,Cilantro Pasta,4,2400.0,[Main Dishes],[Mexican],"[tomatoes, jalapeno chilies, vegetable oil, white onion, water, angel hair, knorr cilantro minicub]"
Easy-Tuna-Pasta-1125241,Easy Tuna Pasta,3,1800.0,[Main Dishes],,"[spring onions, pasta shapes, tuna, sweet corn, mayonnaise]"
Pasta-With-Garlic-and-Oil-_Aglio-et-Olio_-1354631,Pasta With Garlic and Oil (Aglio et Olio),4,1200.0,[Main Dishes],,"[spaghetti, extra-virgin olive oil, large garlic cloves, parmesan cheese, salt, pepper]"
Pumpkin-Cream-Pasta-1370372,Pumpkin Cream Pasta,4,3900.0,[Main Dishes],,"[pasta, heavy cream, pie pumpkin, cinnamon]"
Lemon-Caper-Pesto-Salmon-Pasta-1363251,Lemon Caper Pesto Salmon Pasta,4,1500.0,[Main Dishes],,"[salmon, pasta, fresh spinach, butter, olive oil, garlic, lemon, lemon juice, capers, fresh basil]"
Garlic-Parmesan-Chicken-Lasagna-Bake-1360435,Garlic Parmesan Chicken Lasagna Bake,4,6300.0,[Main Dishes],,"[oven-ready lasagna noodles, chicken meat, peas, grated parmesan cheese, gruyere cheese, water, panko breadcrumbs, fresh thyme, butter, garlic, all-purpose flour, herbes de provence, coarse salt, milk]"
Simple-Seafood-Pasta-1081293,Simple Seafood Pasta,4,1500.0,[Main Dishes],,"[angel hair, shrimp, tomatoes, oregano, extra-virgin olive oil, water]"
White-Chicken-Enchilada-Pasta-1379810,White Chicken Enchilada Pasta,4,3600.0,[Main Dishes],,"[angel hair, olive oil, butter, onions, green chilies, creole seasoning, all-purpose flour, chicken broth, chicken breasts, sour cream, shredded Monterey Jack cheese, chopped cilantro, sliced black olives]"
Homemade-Pasta-1311809,Homemade Pasta,4,1500.0,,,"[all-purpose flour, pasta, eggs, water]"
20-Minute-Tuscan-Chicken-with-Penne-Pasta-1379939,20-Minute Tuscan Chicken with Penne Pasta,4,1500.0,[Main Dishes],[Italian],"[olive oil, garlic cloves, frozen spinach, onions, dried oregano, dried thyme, pepper, salt, dried basil, diced tomatoes, chicken stock, rotisserie chicken, half & half, all-purpose flour, penne pasta, fresh basil, parmesan cheese]"
Creamy-Parmesan-Chicken-And-Broccoli-Pasta-Bake-1360430,Creamy Parmesan Chicken And Broccoli Pasta Bake,3,1500.0,[Main Dishes],,"[boneless chicken breast, frozen broccoli florets, pasta, cream of chicken soup, parmesan cheese, salt, pepper]"
Chicken-Garlic-Pasta-Skillet-_Freezer-Meal_-1379251,Chicken Garlic Pasta Skillet {Freezer Meal},4,3300.0,[Main Dishes],,"[boneless chicken breast, olive oil, butter, italian seasoning, salt, pepper, onions, garlic, chicken broth, diced tomatoes, penne pasta, crushed red pepper flakes, half & half, mozzarella cheese]"
Garlic-Pasta-1003056,Garlic Pasta,4,3000.0,[Main Dishes],,"[garlic, olive oil, dried pasta, butter, pasta sauce, baby portobello mushrooms]"
Sausage-and-Broccoli-Pasta-759224,Sausage and Broccoli Pasta,4,1620.0,[Main Dishes],,"[sweet italian sausage, broccoli, chicken broth, pasta, grated parmesan cheese, salt, pepper]"
Lasagna-Pasta-676284,Lasagna Pasta,4,2100.0,[Main Dishes],,"[bow-tie pasta, olive oil, ground chuck, pasta sauce, salt, garlic powder, italian seasoning, shredded mozzarella cheese, sour cream]"
Tri-Color-Pasta-with-Chickpeas-and-Salami-1360306,Tri Color Pasta with Chickpeas and Salami,4,2400.0,[Main Dishes],,"[dried chickpeas, Mrs. Dash, water, tri-color pasta, olive oil, garlic, shallots, crushed red pepper flakes, hard salami, sea salt]"
Brown-Butter-Pasta-with-Sweet-Potatoes-and-Brussels-Sprouts-1380723,Brown Butter Pasta with Sweet Potatoes and Brussels Sprouts,4,3600.0,[Side Dishes],,"[sweet potatoes, brussels sprouts, purple onion, olive oil, black pepper, salt, unsalted butter, whole wheat pasta, pecans, dried cranberries, feta cheese crumbles]"
Penne-Pasta-with-Dandelions-1376208,Penne Pasta with Dandelions,4,1200.0,[Main Dishes],,"[leaves, garlic, penne pasta, ricotta cheese, salt, ground pepper, olive oil, parmesan cheese]"
Pasta-with-Mushrooms-and-Pumpkin-1354906,Pasta with Mushrooms and Pumpkin,4,3000.0,[Main Dishes],,"[pasta, extra-virgin olive oil, pumpkin, mushrooms, salad, onions, grated parmesan cheese, salt, pepper]"
Cordon-Blue-Skillet-Pasta-1102340,Cordon Blue Skillet Pasta,4,1200.0,[Main Dishes],,"[chicken breasts, country ham, and fat free half half, cheese spread, garlic powder, dried thyme, poultry seasoning, reduced fat swiss cheese, pasta]"
Smooth-And-Savory-Pasta-With-Fresh-Squash-1372868,Smooth And Savory Pasta With Fresh Squash,3,1800.0,[Main Dishes],,"[olive oil, garlic, chicken stock, whole milk, bow-tie pasta, butter, cream cheese, grated parmesan cheese, scallions, salt, pepper]"
Favorite-Slow-Cooker-Pot-Roast-1375421,Favorite Slow Cooker Pot Roast,4,22500.0,,,"[olive oil, mixed spice, boneless beef chuck roast, onions, tomato sauce, water]"
Bacon-Ranch-Pasta-Salad-1365755,Bacon Ranch Pasta Salad,3,2100.0,[Salads],,"[shell pasta, carrots, frozen peas, mayonnaise, Hidden Valley® Original Ranch® Dressing, bacon bits, onion powder]"
Albino-Pasta-Allrecipes,Albino Pasta,4,1500.0,[Main Dishes],,"[penne pasta, olive oil, minced garlic, grated parmesan cheese]"
Michael-Symons-Pasta-with-Brussels-Sprouts-and-Bacon-1376176,Michael Symon’s Pasta with Brussels Sprouts and Bacon,4,2100.0,[Main Dishes],,"[pasta shells, olive oil, bacon, brussels sprouts, minced garlic, parmesan cheese]"
Salmon-Pasta-1037909,Salmon Pasta,4,2400.0,[Main Dishes],,"[whole wheat pasta, extra-virgin olive oil, garlic, salmon, frozen peas, shallots, butter, all-purpose flour, milk, cream, shredded parmesan cheese, salt, pepper, parmesan cheese]"
Creamy-Parmesan-Pumpkin-Pasta-1379522,Creamy Parmesan Pumpkin Pasta,4,2400.0,[Main Dishes],,"[olive oil, butter, garlic, pumpkin purée, unsalted chicken stock, onion powder, chili powder, cayenne pepper, pepper, salt, plain greek yogurt, grated parmesan cheese, rotini]"
Creamy-Chicken-and-Green-Veggie-Pasta-_DF_-1360239,Creamy Chicken and Green Veggie Pasta {DF},4,1800.0,[Main Dishes],,"[penne pasta, extra-virgin olive oil, onions, garlic, zucchini, broccoli, arugula, coconut cream, rotisserie chicken, basil pesto sauce, nutritional yeast]"
